<!DOCTYPE html>
<html>
<head>
<meta http-equiv="X-UA-Compatible" content="IE=edge"/>
<meta http-equiv="Content-Type" content="text/html; charset=utf-8" />
<meta name="viewport" content="width=1000"/>
<title>col3neg,col3,col3negoriginal,col3negoriginal.com,col3 neg,col3 neg original,col3neg original,col3,col3negoriginal.lk | col3neg col3negoriginal.com Col3neg Original</title>
<meta name="description" content="col3negoriginal, col3negoriginal.com, col3, col3neg, col 3 neg original col3negoriginal. A place to watch and share Sri Lankan videos.">
<meta name="keywords" content="col3neg ,col3, col3negoriginal, col3negoriginal.org, col3negoriginal.com, col3negoriginal.lk, col3neg original, TV programs, Live TV, Teledramas, Music Videos, Live at8, Mp3, News Papers, Nethfm,itn, swarnawahini, Derana, jathika rupavahini, News 1st">
<link rel="shortcut icon" href="img/common/favicon.gif"/>
<link href="css/stylesheet.css" type="text/css" rel="stylesheet">
<script src="scripts/prototype.js" type="text/javascript"></script>
</head>
<body>
	
<div id="container"><div id="header-img"><img src="img/saurce/header.gif" width="960" height="169" alt="col3negoriginal.com" /></div>
<div id="mainMenu"><div class="menu-button"><a href="http://www.col3negoriginalcom.com">Home</a></div><div class="menu-button"><a href="http://www.col3negoriginalcom.com/playlists.php">Playlists</a></div><div class="menu-button"><a href="http://www.col3negoriginalcom.com/submit.php">Submit</a></div><div class="menu-button"><a href="http://www.col3negoriginalcom.com/contact.php">Contact Us</a></div><div class="search-holder"><form name="menu_search" action="http://www.col3negoriginalcom.com/search.php" method="get"><input name="q" value="" id="videoSearch"></form></div><div class="menu-button"><a href="#" onclick="document.menu_search.submit(); return false;">Search</a></div><div class="menu-special-button"><a style="cursor:hand;font-family:arial"onclick="this.style.behavior='url(#default#homepage)';this.setHomePage('http://www.col3negoriginalcom.com');"><img src="http://www.col3negoriginalcom.com/img/saurce/homepage.gif" width="25" height="25" alt="Set as Homepage" title="Set this site as Homepage"></a></div></div><div id="top_ads">
<table width="960" border="0" cellpadding="0" cellspacing="0"><tr><td>
	<div id="header-ads-1" class="header-ads-l"><a href="http://airticketonline24.com" target="_blank" rel="nofollow"><img src="http://www.col3negoriginal.me/images/Sadalow.gif" width="480" height="60" /></a></div>
	<div id="header-ads-2" class="header-ads-r"><a href="http://www.lankahotnews.com" target="_blank" rel="nofollow"><img src="http://www.lankahitnews.info/ads/right/col3neg.gif" width="480" height="60" /></a></div>
	<div id="header-ads-3" class="header-ads-l"><a href="contact.php"><img src="http://col3negoriginal.tv/img/ads/zone_a.gif"></a></div>
	<div id="header-ads-4" class="header-ads-r"><a href="http://srigift.com" target="_blank" rel="nofollow"><img src="http://adagossip.com/ads/srigift.gif" width="480" height="60" /></a></div>
	<div id="header-ads-5" class="header-ads-l"><a href="http://www.eccalls.com" target="_blank" rel="nofollow"><img src="http://col3negoriginal.tv/img/ads/1437323219214.gif" width="480" height="60" /></a></div>
	<div id="header-ads-6" class="header-ads-r"><a href="http://www.mangalam.lk" target="_blank" rel="nofollow"><img src="http://col3negoriginal.tv/img/ads/1437323002495.jpg" width="480" height="60" /></a></div>
	<div id="header-ads-7" class="header-ads-l"><a href="contact.php"><img src="http://col3negoriginal.tv/img/ads/zone_b.gif"></a></div>
	<div id="header-ads-8" class="header-ads-r"><a href="http://ceylonfoodcity.com" target="_blank" rel="nofollow"><img src="http://s2.postimg.org/jlt1am4i1/cfc.gif" width="480" height="60" /></a></div>
</td></tr></table>
<div align="center" id="header-full-banners">
</div>
</div>

<div id="main">
<table border="0" cellpadding="0" cellspacing="0"><tr><td>
<div id="leftnavContainer">
<div id="nav"><div id="navHd" class="header"><div>Radio FM (Auto Play)</div></div>
<div class="side-ad-box"><a href="page.php?id=54"><img src="http://col3negoriginal.tv/img/ads/1339252416117.jpg" width="196" height="40" alt=""></a></div>
</div>
<div id="nav"><div id="navHd" class="header"><div>Live Tv</div></div>
</div>
<div id="nav"><div id="navHd" class="header"><div>Paid Advertisements</div></div>
<div class="side-ad-box"><a href="http://www.koluwa.info/" target="_blank" rel="nofollow"><img src="http://www.lankahitnews.info/boxcol3/koluwa/koluwa.gif" width="196" height="126" alt="http://www.koluwa.info/"></a></div>
<div class="side-ad-box"><a href="http://www.jivithaya.info/" target="_blank" rel="nofollow"><img src="http://www.jivithaya.net/images/banners/col3add.gif" width="196" height="126" alt="http://www.jivithaya.info/"></a></div>
<div class="side-ad-box"><a href="http://sithma.com/" target="_blank" rel="nofollow"><img src="http://sithma.com/ad/col3.gif" width="196" height="126" alt="http://sithma.com/"></a></div>
<div class="side-ad-box"><a href="page.php?id=57"><img src="http://col3negoriginal.tv/img/ads/1474451984372.gif" width="196" height="252" alt=""></a></div>
<div class="side-ad-box"><a href="http://srilankanmusicbank.com/" target="_blank" rel="nofollow"><img src="http://lankamusicportal.com/advt/anigif.gif" width="196" height="126" alt="http://srilankanmusicbank.com/"></a></div>
<div class="side-ad-box"><a href="http://www.89models.tk" target="_blank" rel="nofollow"><img src="http://www.educationlk.com/col3.gif" width="196" height="126" alt="http://www.89models.tk"></a></div>
<div class="side-ad-box"><a href="http://www.srimarket.net/" target="_blank" rel="nofollow"><img src="http://srimarket.net/skin/addoriginal.gif" width="196" height="378" alt="http://www.srimarket.net/"></a></div>
</div>
<div id="nav"><div id="navHd" class="header"><div>News Papers</div></div>
<div class="side-ad-box"><div style="width:180px; margin-left:15px;">
    <p><a href="http://www.lankadeepa.lk/" target="_blank"><img style="float:left; margin:0 0 2px 2px;" src="img/newspapers/lankad-head.jpg" alt="Lankadeepa" width="80" height="25" /></a> <a href="http://www.sundayobserver.lk/" target="_blank"><img style="float:left; margin:0 0 2px 2px;" src="img/newspapers/so-head.jpg" alt="Sunday Observer" width="80" height="25" /></a></p>
    <p><a href="http://www.lakbima.lk/" target="_blank"><img style="float:left; margin:0 0 2px 2px;" src="img/newspapers/lakb-head.jpg" alt="Lakbima" width="80" height="25" /></a> <a href="http://www.dailymirror.lk/" target="_blank"><img style="float:left; margin:0 0 2px 2px;" src="img/newspapers/mirror.jpg" alt="Daily Mirror" width="80" height="25" /></a></p>
    <p><a href="http://www.dinamina.lk/" target="_blank"><img style="float:left; margin:0 0 2px 2px;" src="img/newspapers/din-head.jpg" alt="Dinamina" width="80" height="25" /></a> <a href="http://www.island.lk/" target="_blank"><img style="float:left; margin:0 0 2px 2px;" src="img/newspapers/Is-head.jpg" alt="Island" width="80" height="25" /></a></p>
    <p><a href="http://www.lankairida.com/" target="_blank"><img style="float:left; margin:0 0 2px 2px;" src="img/newspapers/helad-head.jpg" alt="Lanka Irida" width="80" height="25" /></a> <a href="http://www.thesundayleader.lk/" target="_blank"><img style="float:left; margin:0 0 2px 2px;" src="img/newspapers/leader-head.jpg" alt="The Sunday Leader" width="80" height="25" /></a></p>
    <p><a href="http://www.divaina.com/" target="_blank"><img style="float:left; margin:0 0 2px 2px;" src="img/newspapers/div-head.jpg" alt="Divaina" width="80" height="25" /></a> <a href="http://www.dailynews.lk/" target="_blank"><img style="float:left; margin:0 0 2px 2px;" src="img/newspapers/cdn-head.jpg" alt="Daily News" width="80" height="25" /></a></p>
    <p><a href="http://www.ravaya.lk/" target="_blank"><img style="float:left; margin:0 0 2px 2px;" src="img/newspapers/rava-head.jpg" alt="Ravaya" width="80" height="25" /></a> <a href="http://www.adaderana.lk" target="_blank"><img style="float:left; margin:0 0 2px 2px;" src="img/newspapers/adaderana.jpg" alt="Ada Derana" width="80" height="25"/></a></p>
    <p><a href="http://www.mawbima.lk" target="_blank"><img style="float:left; margin:0 0 2px 2px;" src="img/newspapers/mawbima.jpg" alt="Mawbima" width="80" height="25" /></a> <a href="http://www.lankapage.com" target="_blank"><img style="float:left; margin:0 0 2px 2px;" src="img/newspapers/lankapeg.jpg" alt="Lanka Page" width="80" height="25" /></a></p>
    <p><a href="http://www.ethalaya.com" target="_blank"><img style="float:left; margin:0 0 2px 2px;" src="img/newspapers/ethalaya.jpg" alt="Ethalaya" width="80" height="25" /></a> <a href="http://www.newsfirst.lk" target="_blank"><img style="float:left; margin:0 0 2px 2px;" src="img/newspapers/newsfirst.jpg" alt="News 1st" width="80" height="25" /></a></p>
    <p><a href="http://www.silumina.lk/" target="_blank"><img style="float:left; margin:0 0 2px 2px;" src="img/newspapers/silu-head.jpg" alt="Silumina" width="80" height="25" /></a> <a href="http://www.sundaytimes.lk/" target="_blank"><img style="float:left; margin:0 0 2px 2px;" src="img/newspapers/times-head.jpg" alt="Sunday Times" width="80" height="25" /></a></p>
    <p><a href="http://www.rivira.lk/" target="_blank"><img style="float:left; margin:0 0 2px 2px;" src="img/newspapers/rivir-head.jpg" alt="Rivira" width="80" height="25" /></a> <a href="http://www.infolanka.com/" target="_blank"><img style="float:left; margin:0 0 2px 2px;" src="img/newspapers/infolanka.jpg" alt="Info Lanka" width="80" height="25" /></a></p>
    <p><a href="http://www.vidusara.com/" target="_blank"><img style="float:left; margin:0 0 2px 2px;" src="img/newspapers/vidusa-head.jpg" alt="Vidusara" width="80" height="25" /></a> <a href="http://www.navaliya.com/" target="_blank"><img style="float:left; margin:0 0 2px 2px;" src="img/newspapers/navali-head.jpg" alt="Navaliya" width="80" height="25" /></a></p>
    <p><a href="http://www.lankaenews.com/Sinhala" target="_blank"><img style="float:left; margin:0 0 2px 2px;" src="img/newspapers/enews.jpg" alt="Lanka Enews" title="enews" width="80" height="25" /></a> <a href="http://vimasuma.com" target="_blank"><img style="float:left; margin:0 0 2px 2px;" src="img/newspapers/vimasuma.jpg" alt="Vimasuma" width="80" height="25" /></a></p>
</div></div>
</div>
</div>

<div id="center">
<div id="nav"><div id="center-navHd" class="header"><div>Paid Advertisements</div></div>
<div align="center" class="center-ad-box"><a href="http://www.cheapitalianhotels.com" target="_blank" rel="nofollow"><img src="http://www.mydubaihotels.info/ads/col3neg.gif" alt="http://www.cheapitalianhotels.com" width="536" height="72" /></a></div><div align="center" class="center-ad-box"><a href="page.php?id=60"><img src="http://col3negoriginal.tv/img/ads/1474463603259.gif" width="550" height="72" /></a></div><div align="center" class="center-ad-box"><a href="http://www.lkkorea.com" target="_blank" rel="nofollow"><img src="http://www.lkkorea.com//sricargo-22.gif" alt="http://www.lkkorea.com" width="536" height="72" /></a></div><div align="center" class="center-ad-box"><a href="page.php?id=59"><img src="http://col3negoriginal.tv/img/ads/1474452642360.gif" width="550" height="72" /></a></div><div align="center" class="center-ad-box"><a href="http://lkmegafuns.info/" target="_blank" rel="nofollow"><img src="http://lkmegafuns.info/colad/megafunad.gif" alt="http://lkmegafuns.info/" width="550" height="72" /></a></div><div align="center" class="center-ad-box"><a href="http://www.myaustralianhotels.com" target="_blank" rel="nofollow"><img src="http://www.mydubaihotels.info/ads/col3neg5.gif" alt="http://www.myaustralianhotels.com" width="536" height="72" /></a></div></div>
<script> var current_page = 1; var total_pages = 9004; var paramString_recent = "&cat=0"; function shift_page_recent ( delta ) { var page = current_page + delta; if ( page < 1 ) { page = total_pages } if ( page > total_pages ) { page = 1 } show_page_recent( page ); } function show_page_recent ( pagenum ) { new Ajax.Updater( 'page_panels_recent', 'cat_panel.php?page=' + pagenum + paramString_recent + "", { evalScripts: true }); current_page = pagenum; var counter = 0; $$('#page_links_recent a').each( function(el) { ( ++ counter == current_page ) ? el.addClassName('page_selected') : el.removeClassName('page_selected') } ); } </script>
<div class="vcat-main-title"><div id="contentHd"><div>Recently Added Videos</div></div></div><div class="vcat-cell"><div class="vcat-cell-header"><div class="vcat-cell-header-text"><span class="vcat-cell-title-text" id="page_links_recent">Pages: <a href="./?page=1" onclick="show_page_recent(1); return false" class="page_num page_selected">1</a>  <a href="./?page=2" onclick="show_page_recent(2); return false" class="page_num">2</a> <a href="./?page=3" onclick="show_page_recent(3); return false" class="page_num">3</a></span><span class="cat-search-link"><a href="recent.php">View all 81033 col3neg items</a></span></div></div><div class="recent-vcat-cell-body" id="page_panels_recent"><table border="0" cellpadding="0" cellspacing="0"><tr><td><div align="center" class="recent-video-cell"><div class="recent-video-thumb-wrapper"><a href="http://www.col3negoriginalcom.com/watch.php?id=111555" title="Derana Aruna 17-03-2018"><img src="http://col3negoriginal.tv/img/category/derana-aruna.jpg" alt="Derana Aruna 17-03-2018" border="0" height="122" width="163"></a></div><div class="video-title"><a href="http://www.col3negoriginalcom.com/watch.php?id=111555" title="Derana Aruna 17-03-2018">Derana Aruna 17-03-2018</a></div><div class="posted-time">Posted 2018-03-17<div class="posted-by">by <span class="poster">Col3neg</span></div></div><div class="video-views">Viewed 672 times</div><div class="filter-show-link"><a href="more.php?show=724">view all items</a></div></div>
<div align="center" class="recent-video-cell"><div class="recent-video-thumb-wrapper"><a href="http://www.col3negoriginalcom.com/watch.php?id=111554" title="Paththare Wisthare 17-03-2018"><img src="http://col3negoriginal.tv/img/category/paththare-wisthare.jpg" alt="Paththare Wisthare 17-03-2018" border="0" height="122" width="163"></a></div><div class="video-title"><a href="http://www.col3negoriginalcom.com/watch.php?id=111554" title="Paththare Wisthare 17-03-2018">Paththare Wisthare 17-03-2018</a></div><div class="posted-time">Posted 2018-03-17<div class="posted-by">by <span class="poster">Col3neg</span></div></div><div class="video-views">Viewed 2107 times</div><div class="filter-show-link"><a href="more.php?show=255">view all items</a></div></div>
<div align="center" class="recent-video-cell"><div class="recent-video-thumb-wrapper"><a href="http://www.col3negoriginalcom.com/watch.php?id=111553" title="Chat and Music 16-03-2018"><img src="http://col3negoriginal.tv/img/category/chat-and-music.jpg" alt="Chat and Music 16-03-2018" border="0" height="122" width="163"></a></div><div class="video-title"><a href="http://www.col3negoriginalcom.com/watch.php?id=111553" title="Chat and Music 16-03-2018">Chat and Music 16-03-2018</a></div><div class="posted-time">Posted 2018-03-17<div class="posted-by">by <span class="poster">Col3neg</span></div></div><div class="video-views">Viewed 5377 times</div><div class="filter-show-link"><a href="more.php?show=90">view all items</a></div></div>
<div align="center" class="recent-video-cell"><div class="recent-video-thumb-wrapper"><a href="http://www.col3negoriginalcom.com/watch.php?id=111552" title="Ma Nowana Mama 16-03-2018"><img src="http://col3negoriginal.tv/img/category/ma-nowana-mama.jpg" alt="Ma Nowana Mama 16-03-2018" border="0" height="122" width="163"></a></div><div class="video-title"><a href="http://www.col3negoriginalcom.com/watch.php?id=111552" title="Ma Nowana Mama 16-03-2018">Ma Nowana Mama 16-03-2018</a></div><div class="posted-time">Posted 2018-03-17<div class="posted-by">by <span class="poster">Col3neg</span></div></div><div class="video-views">Viewed 5315 times</div><div class="filter-show-link"><a href="more.php?show=527">view all items</a></div></div>
<div align="center" class="recent-video-cell"><div class="recent-video-thumb-wrapper"><a href="http://www.col3negoriginalcom.com/watch.php?id=111550" title="Sandata Diwura Kiyannam (23) - 16-03-2018"><img src="http://col3negoriginal.tv/img/category/sandata-diwura-kiyannam-teledrama.jpg" alt="Sandata Diwura Kiyannam (23) - 16-03-2018" border="0" height="122" width="163"></a></div><div class="video-title"><a href="http://www.col3negoriginalcom.com/watch.php?id=111550" title="Sandata Diwura Kiyannam (23) - 16-03-2018">Sandata Diwura Kiyannam (23) - 16-03-2018</a></div><div class="posted-time">Posted 2018-03-16<div class="posted-by">by <span class="poster">Col3neg</span></div></div><div class="video-views">Viewed 1929 times</div><div class="filter-show-link"><a href="more.php?show=883">view all items</a></div></div>
<div align="center" class="recent-video-cell"><div class="recent-video-thumb-wrapper"><a href="http://www.col3negoriginalcom.com/watch.php?id=111549" title="Paali (29) - 16-03-2018"><img src="http://col3negoriginal.tv/img/category/paali-teledrama.jpg" alt="Paali (29) - 16-03-2018" border="0" height="122" width="163"></a></div><div class="video-title"><a href="http://www.col3negoriginalcom.com/watch.php?id=111549" title="Paali (29) - 16-03-2018">Paali (29) - 16-03-2018</a></div><div class="posted-time">Posted 2018-03-16<div class="posted-by">by <span class="poster">Col3neg</span></div></div><div class="video-views">Viewed 3665 times</div><div class="filter-show-link"><a href="more.php?show=882">view all items</a></div></div>
<div align="center" class="recent-video-cell"><div class="recent-video-thumb-wrapper"><a href="http://www.col3negoriginalcom.com/watch.php?id=111551" title="Sirasa News 1st 10.00 - 16-03-2018"><img src="http://col3negoriginal.tv/img/category/newst-1st.jpg" alt="Sirasa News 1st 10.00 - 16-03-2018" border="0" height="122" width="163"></a></div><div class="video-title"><a href="http://www.col3negoriginalcom.com/watch.php?id=111551" title="Sirasa News 1st 10.00 - 16-03-2018">Sirasa News 1st 10.00 - 16-03-2018</a></div><div class="posted-time">Posted 2018-03-16<div class="posted-by">by <span class="poster">Col3neg</span></div></div><div class="video-views">Viewed 4261 times</div><div class="filter-show-link"><a href="more.php?show=36">view all items</a></div></div>
<div align="center" class="recent-video-cell"><div class="recent-video-thumb-wrapper"><a href="http://www.col3negoriginalcom.com/watch.php?id=111548" title="Nataka Marai (708) - 16-03-2018"><img src="http://col3negoriginal.tv/img/category/nataka-marai-nawaya-hamarai-tele-drama.jpg" alt="Nataka Marai (708) - 16-03-2018" border="0" height="122" width="163"></a></div><div class="video-title"><a href="http://www.col3negoriginalcom.com/watch.php?id=111548" title="Nataka Marai (708) - 16-03-2018">Nataka Marai (708) - 16-03-2018</a></div><div class="posted-time">Posted 2018-03-16<div class="posted-by">by <span class="poster">Col3neg</span></div></div><div class="video-views">Viewed 5376 times</div><div class="filter-show-link"><a href="more.php?show=477">view all items</a></div></div>
<div align="center" class="recent-video-cell"><div class="recent-video-thumb-wrapper"><a href="http://www.col3negoriginalcom.com/watch.php?id=111547" title="Deweni Inima (290) - 16-03-2018"><img src="http://col3negoriginal.tv/img/category/deweni-inima-teledrama.jpg" alt="Deweni Inima (290) - 16-03-2018" border="0" height="122" width="163"></a></div><div class="video-title"><a href="http://www.col3negoriginalcom.com/watch.php?id=111547" title="Deweni Inima (290) - 16-03-2018">Deweni Inima (290) - 16-03-2018</a></div><div class="posted-time">Posted 2018-03-16<div class="posted-by">by <span class="poster">Col3neg</span></div></div><div class="video-views">Viewed 20649 times</div><div class="filter-show-link"><a href="more.php?show=737">view all items</a></div></div>
</td></tr></table></div></div>
      
<div id="nav"><div id="center-navHd" class="header"><div>Paid Advertisements</div></div>
<div align="center" class="center-ad-box"><a href="http://www.cheapitalianhotels.com" target="_blank" rel="nofollow"><img src="http://www.mydubaihotels.info/ads/col3neg2.gif" alt="http://www.cheapitalianhotels.com" width="536" height="72" /></a></div><div align="center" class="center-ad-box"><a href="http://www.myaustralianhotels.com" target="_blank" rel="nofollow"><img src="http://www.mydubaihotels.info/ads/col3neg3.gif" alt="http://www.myaustralianhotels.com" width="536" height="72" /></a></div><div align="center" class="center-ad-box"><a href="http://www.lankacnews1.com/" target="_blank" rel="nofollow"><img src="http://lankanewsc.info//ads/col3nego.gif" alt="http://www.lankacnews1.com/" width="550" height="72" /></a></div><div align="center" class="center-ad-box"><a href="http://www.lkentertainment.info/" target="_blank" rel="nofollow"><img src="http://lkmegafuns.info/lkepaidadd/MaduraAdd.gif" alt="http://www.lkentertainment.info/" width="550" height="72" /></a></div><div align="center" class="center-ad-box"><a href="http://originalgossiplankanew.blogspot.com/" target="_blank" rel="nofollow"><img src="http://modalsbank.com/col3ad.gif" alt="http://originalgossiplankanew.blogspot.com/" width="550" height="72" /></a></div></div>
<script> var current_page = 1; var total_pages = 4960; var paramString_1 = "&cat=1"; function shift_page_1 ( delta ) { var page = current_page + delta; if ( page < 1 ) { page = total_pages } if ( page > total_pages ) { page = 1 } show_page_1( page ); } function show_page_1 ( pagenum ) { new Ajax.Updater( 'page_panels_1', 'cat_panel.php?page=' + pagenum + paramString_1 + "", { evalScripts: true }); current_page = pagenum; var counter = 0; $$('#page_links_1 a').each( function(el) { ( ++ counter == current_page ) ? el.addClassName('page_selected') : el.removeClassName('page_selected') } ); } </script>
<div id="col3negoriginal-playlist-1" class="vcat-main-title"><div class="contentHd"><div>News Page</div></div></div><div class="vcat-cell"><div class="vcat-cell-header"><div class="vcat-cell-header-text"><span class="vcat-cell-title-text" id="page_links_1">Pages: <a href="./?page=1" onclick="show_page_1(1); return false" class="page_num page_selected">1</a>  <a href="./?page=2" onclick="show_page_1(2); return false" class="page_num">2</a> <a href="./?page=3" onclick="show_page_1(3); return false" class="page_num">3</a></span><span class="cat-search-link"><a href="more.php?cat=1">View all 19840 items</a></span></div></div><div class="vcat-cell-body" id="page_panels_1"><table border="0" cellpadding="0" cellspacing="0"><tr><td><div align="center" class="video-cell"><div class="video-thumb-wrapper"><a href="http://www.col3negoriginalcom.com/watch.php?id=111555" title="Derana Aruna 17-03-2018"><img src="http://col3negoriginal.tv/img/category/derana-aruna.jpg" alt="Derana Aruna 17-03-2018" border="0" height="90" width="118"></a></div><div class="video-title"><a href="http://www.col3negoriginalcom.com/watch.php?id=111555" title="Derana Aruna 17-03-2018">Derana Aruna 17-03-2018</a></div><div class="posted-time">Posted 2018-03-17<div class="posted-by">by <span class="poster">Col3neg</span></div></div><div class="video-views">Viewed 672 times</div><div class="filter-show-link"><a href="more.php?show=724">view all items</a></div></div>
<div align="center" class="video-cell"><div class="video-thumb-wrapper"><a href="http://www.col3negoriginalcom.com/watch.php?id=111554" title="Paththare Wisthare 17-03-2018"><img src="http://col3negoriginal.tv/img/category/paththare-wisthare.jpg" alt="Paththare Wisthare 17-03-2018" border="0" height="90" width="118"></a></div><div class="video-title"><a href="http://www.col3negoriginalcom.com/watch.php?id=111554" title="Paththare Wisthare 17-03-2018">Paththare Wisthare 17-03-2018</a></div><div class="posted-time">Posted 2018-03-17<div class="posted-by">by <span class="poster">Col3neg</span></div></div><div class="video-views">Viewed 2107 times</div><div class="filter-show-link"><a href="more.php?show=255">view all items</a></div></div>
<div align="center" class="video-cell"><div class="video-thumb-wrapper"><a href="http://www.col3negoriginalcom.com/watch.php?id=111551" title="Sirasa News 1st 10.00 - 16-03-2018"><img src="http://col3negoriginal.tv/img/category/newst-1st.jpg" alt="Sirasa News 1st 10.00 - 16-03-2018" border="0" height="90" width="118"></a></div><div class="video-title"><a href="http://www.col3negoriginalcom.com/watch.php?id=111551" title="Sirasa News 1st 10.00 - 16-03-2018">Sirasa News 1st 10.00 - 16-03-2018</a></div><div class="posted-time">Posted 2018-03-16<div class="posted-by">by <span class="poster">Col3neg</span></div></div><div class="video-views">Viewed 4261 times</div><div class="filter-show-link"><a href="more.php?show=36">view all items</a></div></div>
<div align="center" class="video-cell"><div class="video-thumb-wrapper"><a href="http://www.col3negoriginalcom.com/watch.php?id=111546" title="TV 1 News 16-03-2018"><img src="http://col3negoriginal.tv/img/category/english-news.jpg" alt="TV 1 News 16-03-2018" border="0" height="90" width="118"></a></div><div class="video-title"><a href="http://www.col3negoriginalcom.com/watch.php?id=111546" title="TV 1 News 16-03-2018">TV 1 News 16-03-2018</a></div><div class="posted-time">Posted 2018-03-16<div class="posted-by">by <span class="poster">Col3neg</span></div></div><div class="video-views">Viewed 503 times</div><div class="filter-show-link"><a href="more.php?show=87">view all items</a></div></div>
<div align="center" class="video-cell"><div class="video-thumb-wrapper"><a href="http://www.col3negoriginalcom.com/watch.php?id=111545" title="Shakthi News 16-03-2018"><img src="http://col3negoriginal.tv/img/category/shakthi-news.jpg" alt="Shakthi News 16-03-2018" border="0" height="90" width="118"></a></div><div class="video-title"><a href="http://www.col3negoriginalcom.com/watch.php?id=111545" title="Shakthi News 16-03-2018">Shakthi News 16-03-2018</a></div><div class="posted-time">Posted 2018-03-16<div class="posted-by">by <span class="poster">Col3neg</span></div></div><div class="video-views">Viewed 324 times</div><div class="filter-show-link"><a href="more.php?show=86">view all items</a></div></div>
<div align="center" class="video-cell"><div class="video-thumb-wrapper"><a href="http://www.col3negoriginalcom.com/watch.php?id=111524" title="Sirasa News 1st 16-03-2018"><img src="http://col3negoriginal.tv/img/category/newst-1st.jpg" alt="Sirasa News 1st 16-03-2018" border="0" height="90" width="118"></a></div><div class="video-title"><a href="http://www.col3negoriginalcom.com/watch.php?id=111524" title="Sirasa News 1st 16-03-2018">Sirasa News 1st 16-03-2018</a></div><div class="posted-time">Posted 2018-03-16<div class="posted-by">by <span class="poster">Col3neg</span></div></div><div class="video-views">Viewed 2448 times</div><div class="filter-show-link"><a href="more.php?show=36">view all items</a></div></div>
<div align="center" class="video-cell"><div class="video-thumb-wrapper"><a href="http://www.col3negoriginalcom.com/watch.php?id=111514" title="Live at 7 - 16-03-2018"><img src="http://col3negoriginal.tv/img/category/live-at-7.jpg" alt="Live at 7 - 16-03-2018" border="0" height="90" width="118"></a></div><div class="video-title"><a href="http://www.col3negoriginalcom.com/watch.php?id=111514" title="Live at 7 - 16-03-2018">Live at 7 - 16-03-2018</a></div><div class="posted-time">Posted 2018-03-16<div class="posted-by">by <span class="poster">Col3neg</span></div></div><div class="video-views">Viewed 6271 times</div><div class="filter-show-link"><a href="more.php?show=794">view all items</a></div></div>
<div align="center" class="video-cell"><div class="video-thumb-wrapper"><a href="http://www.col3negoriginalcom.com/watch.php?id=111509" title="Derana News 16-03-2018"><img src="http://col3negoriginal.tv/img/category/derana-news.jpg" alt="Derana News 16-03-2018" border="0" height="90" width="118"></a></div><div class="video-title"><a href="http://www.col3negoriginalcom.com/watch.php?id=111509" title="Derana News 16-03-2018">Derana News 16-03-2018</a></div><div class="posted-time">Posted 2018-03-16<div class="posted-by">by <span class="poster">Col3neg</span></div></div><div class="video-views">Viewed 7638 times</div><div class="filter-show-link"><a href="more.php?show=39">view all items</a></div></div>
</td></tr></table></div></div><script> var current_page = 1; var total_pages = 1049; var paramString_3 = "&cat=3"; function shift_page_3 ( delta ) { var page = current_page + delta; if ( page < 1 ) { page = total_pages } if ( page > total_pages ) { page = 1 } show_page_3( page ); } function show_page_3 ( pagenum ) { new Ajax.Updater( 'page_panels_3', 'cat_panel.php?page=' + pagenum + paramString_3 + "", { evalScripts: true }); current_page = pagenum; var counter = 0; $$('#page_links_3 a').each( function(el) { ( ++ counter == current_page ) ? el.addClassName('page_selected') : el.removeClassName('page_selected') } ); } </script>
<div id="col3negoriginal-playlist-3" class="vcat-main-title"><div class="contentHd"><div>Political Programs</div></div></div><div class="vcat-cell"><div class="vcat-cell-header"><div class="vcat-cell-header-text"><span class="vcat-cell-title-text" id="page_links_3">Pages: <a href="./?page=1" onclick="show_page_3(1); return false" class="page_num page_selected">1</a>  <a href="./?page=2" onclick="show_page_3(2); return false" class="page_num">2</a> <a href="./?page=3" onclick="show_page_3(3); return false" class="page_num">3</a></span><span class="cat-search-link"><a href="more.php?cat=3">View all 4194 items</a></span></div></div><div class="vcat-cell-body" id="page_panels_3"><table border="0" cellpadding="0" cellspacing="0"><tr><td><div align="center" class="video-cell"><div class="video-thumb-wrapper"><a href="http://www.col3negoriginalcom.com/watch.php?id=111516" title="Satana 16-03-2018"><img src="http://col3negoriginal.tv/img/category/satana.jpg" alt="Satana 16-03-2018" border="0" height="90" width="118"></a></div><div class="video-title"><a href="http://www.col3negoriginalcom.com/watch.php?id=111516" title="Satana 16-03-2018">Satana 16-03-2018</a></div><div class="posted-time">Posted 2018-03-16<div class="posted-by">by <span class="poster">Col3neg</span></div></div><div class="video-views">Viewed 2414 times</div><div class="filter-show-link"><a href="more.php?show=120">view all items</a></div></div>
<div align="center" class="video-cell"><div class="video-thumb-wrapper"><a href="http://www.col3negoriginalcom.com/watch.php?id=111497" title="Balaya 15-03-2018"><img src="http://col3negoriginal.tv/img/category/balaya.jpg" alt="Balaya 15-03-2018" border="0" height="90" width="118"></a></div><div class="video-title"><a href="http://www.col3negoriginalcom.com/watch.php?id=111497" title="Balaya 15-03-2018">Balaya 15-03-2018</a></div><div class="posted-time">Posted 2018-03-16<div class="posted-by">by <span class="poster">Col3neg</span></div></div><div class="video-views">Viewed 8819 times</div><div class="filter-show-link"><a href="more.php?show=261">view all items</a></div></div>
<div align="center" class="video-cell"><div class="video-thumb-wrapper"><a href="http://www.col3negoriginalcom.com/watch.php?id=111496" title="The Hot Seat 15-03-2018"><img src="http://col3negoriginal.tv/img/category/the-hot-seat.jpg" alt="The Hot Seat 15-03-2018" border="0" height="90" width="118"></a></div><div class="video-title"><a href="http://www.col3negoriginalcom.com/watch.php?id=111496" title="The Hot Seat 15-03-2018">The Hot Seat 15-03-2018</a></div><div class="posted-time">Posted 2018-03-15<div class="posted-by">by <span class="poster">Col3neg</span></div></div><div class="video-views">Viewed 1035 times</div><div class="filter-show-link"><a href="more.php?show=466">view all items</a></div></div>
<div align="center" class="video-cell"><div class="video-thumb-wrapper"><a href="http://www.col3negoriginalcom.com/watch.php?id=111494" title="Theeranaya 15-03-2018"><img src="http://col3negoriginal.tv/img/category/theeranaya.jpg" alt="Theeranaya 15-03-2018" border="0" height="90" width="118"></a></div><div class="video-title"><a href="http://www.col3negoriginalcom.com/watch.php?id=111494" title="Theeranaya 15-03-2018">Theeranaya 15-03-2018</a></div><div class="posted-time">Posted 2018-03-15<div class="posted-by">by <span class="poster">Col3neg</span></div></div><div class="video-views">Viewed 1983 times</div><div class="filter-show-link"><a href="more.php?show=895">view all items</a></div></div>
<div align="center" class="video-cell"><div class="video-thumb-wrapper"><a href="http://www.col3negoriginalcom.com/watch.php?id=111457" title="Dawasa 15-03-2018"><img src="http://col3negoriginal.tv/img/category/dawasa.jpg" alt="Dawasa 15-03-2018" border="0" height="90" width="118"></a></div><div class="video-title"><a href="http://www.col3negoriginalcom.com/watch.php?id=111457" title="Dawasa 15-03-2018">Dawasa 15-03-2018</a></div><div class="posted-time">Posted 2018-03-15<div class="posted-by">by <span class="poster">Col3neg</span></div></div><div class="video-views">Viewed 1462 times</div><div class="filter-show-link"><a href="more.php?show=513">view all items</a></div></div>
<div align="center" class="video-cell"><div class="video-thumb-wrapper"><a href="http://www.col3negoriginalcom.com/watch.php?id=111440" title="Aluth Parlimenthuwa 14-03-2018"><img src="http://col3negoriginal.tv/img/category/aluth-parlimenthuwa.jpg" alt="Aluth Parlimenthuwa 14-03-2018" border="0" height="90" width="118"></a></div><div class="video-title"><a href="http://www.col3negoriginalcom.com/watch.php?id=111440" title="Aluth Parlimenthuwa 14-03-2018">Aluth Parlimenthuwa 14-03-2018</a></div><div class="posted-time">Posted 2018-03-15<div class="posted-by">by <span class="poster">Col3neg</span></div></div><div class="video-views">Viewed 5584 times</div><div class="filter-show-link"><a href="more.php?show=503">view all items</a></div></div>
<div align="center" class="video-cell"><div class="video-thumb-wrapper"><a href="http://www.col3negoriginalcom.com/watch.php?id=111437" title="Sampoorna Kathawa 14-03-2018"><img src="http://col3negoriginal.tv/img/category/1348253170999.jpg" alt="Sampoorna Kathawa 14-03-2018" border="0" height="90" width="118"></a></div><div class="video-title"><a href="http://www.col3negoriginalcom.com/watch.php?id=111437" title="Sampoorna Kathawa 14-03-2018">Sampoorna Kathawa 14-03-2018</a></div><div class="posted-time">Posted 2018-03-14<div class="posted-by">by <span class="poster">Col3neg</span></div></div><div class="video-views">Viewed 1451 times</div><div class="filter-show-link"><a href="more.php?show=46">view all items</a></div></div>
<div align="center" class="video-cell"><div class="video-thumb-wrapper"><a href="http://www.col3negoriginalcom.com/watch.php?id=111438" title="Wanija Warthawa 14-03-2018"><img src="http://col3negoriginal.tv/img/category/wanija-warthawa.jpg" alt="Wanija Warthawa 14-03-2018" border="0" height="90" width="118"></a></div><div class="video-title"><a href="http://www.col3negoriginalcom.com/watch.php?id=111438" title="Wanija Warthawa 14-03-2018">Wanija Warthawa 14-03-2018</a></div><div class="posted-time">Posted 2018-03-14<div class="posted-by">by <span class="poster">Col3neg</span></div></div><div class="video-views">Viewed 988 times</div><div class="filter-show-link"><a href="more.php?show=699">view all items</a></div></div>
</td></tr></table></div></div><script> var current_page = 1; var total_pages = 401; var paramString_4 = "&cat=4"; function shift_page_4 ( delta ) { var page = current_page + delta; if ( page < 1 ) { page = total_pages } if ( page > total_pages ) { page = 1 } show_page_4( page ); } function show_page_4 ( pagenum ) { new Ajax.Updater( 'page_panels_4', 'cat_panel.php?page=' + pagenum + paramString_4 + "", { evalScripts: true }); current_page = pagenum; var counter = 0; $$('#page_links_4 a').each( function(el) { ( ++ counter == current_page ) ? el.addClassName('page_selected') : el.removeClassName('page_selected') } ); } </script>
<div id="col3negoriginal-playlist-4" class="vcat-main-title"><div class="contentHd"><div>Dharma Deshana</div></div></div><div class="vcat-cell"><div class="vcat-cell-header"><div class="vcat-cell-header-text"><span class="vcat-cell-title-text" id="page_links_4">Pages: <a href="./?page=1" onclick="show_page_4(1); return false" class="page_num page_selected">1</a>  <a href="./?page=2" onclick="show_page_4(2); return false" class="page_num">2</a> <a href="./?page=3" onclick="show_page_4(3); return false" class="page_num">3</a></span><span class="cat-search-link"><a href="more.php?cat=4">View all 1603 items</a></span></div></div><div class="vcat-cell-body" id="page_panels_4"><table border="0" cellpadding="0" cellspacing="0"><tr><td><div align="center" class="video-cell"><div class="video-thumb-wrapper"><a href="http://www.col3negoriginalcom.com/watch.php?id=111523" title="Hiru Sandaham Res 16-03-2018"><img src="http://col3negoriginal.tv/img/category/hiru-sandaham-res.jpg" alt="Hiru Sandaham Res 16-03-2018" border="0" height="90" width="118"></a></div><div class="video-title"><a href="http://www.col3negoriginalcom.com/watch.php?id=111523" title="Hiru Sandaham Res 16-03-2018">Hiru Sandaham Res 16-03-2018</a></div><div class="posted-time">Posted 2018-03-16<div class="posted-by">by <span class="poster">Col3neg</span></div></div><div class="video-views">Viewed 404 times</div><div class="filter-show-link"><a href="more.php?show=676">view all items</a></div></div>
<div align="center" class="video-cell"><div class="video-thumb-wrapper"><a href="http://www.col3negoriginalcom.com/watch.php?id=111462" title="Ehipassiko 15-03-2018"><img src="http://col3negoriginal.tv/img/category/ehipassiko.jpg" alt="Ehipassiko 15-03-2018" border="0" height="90" width="118"></a></div><div class="video-title"><a href="http://www.col3negoriginalcom.com/watch.php?id=111462" title="Ehipassiko 15-03-2018">Ehipassiko 15-03-2018</a></div><div class="posted-time">Posted 2018-03-15<div class="posted-by">by <span class="poster">Col3neg</span></div></div><div class="video-views">Viewed 858 times</div><div class="filter-show-link"><a href="more.php?show=675">view all items</a></div></div>
<div align="center" class="video-cell"><div class="video-thumb-wrapper"><a href="http://www.col3negoriginalcom.com/watch.php?id=111325" title="Ehipassiko 13-03-2018"><img src="http://col3negoriginal.tv/img/category/ehipassiko.jpg" alt="Ehipassiko 13-03-2018" border="0" height="90" width="118"></a></div><div class="video-title"><a href="http://www.col3negoriginalcom.com/watch.php?id=111325" title="Ehipassiko 13-03-2018">Ehipassiko 13-03-2018</a></div><div class="posted-time">Posted 2018-03-13<div class="posted-by">by <span class="poster">Col3neg</span></div></div><div class="video-views">Viewed 1500 times</div><div class="filter-show-link"><a href="more.php?show=675">view all items</a></div></div>
<div align="center" class="video-cell"><div class="video-thumb-wrapper"><a href="http://www.col3negoriginalcom.com/watch.php?id=111288" title="Doramadalawa 12-03-2018"><img src="http://col3negoriginal.tv/img/category/1348253685831.jpg" alt="Doramadalawa 12-03-2018" border="0" height="90" width="118"></a></div><div class="video-title"><a href="http://www.col3negoriginalcom.com/watch.php?id=111288" title="Doramadalawa 12-03-2018">Doramadalawa 12-03-2018</a></div><div class="posted-time">Posted 2018-03-13<div class="posted-by">by <span class="poster">Col3neg</span></div></div><div class="video-views">Viewed 4805 times</div><div class="filter-show-link"><a href="more.php?show=49">view all items</a></div></div>
</td></tr></table></div></div><script> var current_page = 1; var total_pages = 140; var paramString_661 = "&cat=661"; function shift_page_661 ( delta ) { var page = current_page + delta; if ( page < 1 ) { page = total_pages } if ( page > total_pages ) { page = 1 } show_page_661( page ); } function show_page_661 ( pagenum ) { new Ajax.Updater( 'page_panels_661', 'cat_panel.php?page=' + pagenum + paramString_661 + "", { evalScripts: true }); current_page = pagenum; var counter = 0; $$('#page_links_661 a').each( function(el) { ( ++ counter == current_page ) ? el.addClassName('page_selected') : el.removeClassName('page_selected') } ); } </script>
<div id="col3negoriginal-playlist-661" class="vcat-main-title"><div class="contentHd"><div>Astrology</div></div></div><div class="vcat-cell"><div class="vcat-cell-header"><div class="vcat-cell-header-text"><span class="vcat-cell-title-text" id="page_links_661">Pages: <a href="./?page=1" onclick="show_page_661(1); return false" class="page_num page_selected">1</a>  <a href="./?page=2" onclick="show_page_661(2); return false" class="page_num">2</a> <a href="./?page=3" onclick="show_page_661(3); return false" class="page_num">3</a></span><span class="cat-search-link"><a href="more.php?cat=661">View all 558 items</a></span></div></div><div class="vcat-cell-body" id="page_panels_661"><table border="0" cellpadding="0" cellspacing="0"><tr><td><div align="center" class="video-cell"><div class="video-thumb-wrapper"><a href="http://www.col3negoriginalcom.com/watch.php?id=111501" title="Tharu Walalla 16-03-2018"><img src="http://col3negoriginal.tv/img/category/tharu-walalla.jpg" alt="Tharu Walalla 16-03-2018" border="0" height="90" width="118"></a></div><div class="video-title"><a href="http://www.col3negoriginalcom.com/watch.php?id=111501" title="Tharu Walalla 16-03-2018">Tharu Walalla 16-03-2018</a></div><div class="posted-time">Posted 2018-03-16<div class="posted-by">by <span class="poster">Col3neg</span></div></div><div class="video-views">Viewed 2013 times</div><div class="filter-show-link"><a href="more.php?show=604">view all items</a></div></div>
<div align="center" class="video-cell"><div class="video-thumb-wrapper"><a href="http://www.col3negoriginalcom.com/watch.php?id=111443" title="Tharu Walalla 15-03-2018"><img src="http://col3negoriginal.tv/img/category/tharu-walalla.jpg" alt="Tharu Walalla 15-03-2018" border="0" height="90" width="118"></a></div><div class="video-title"><a href="http://www.col3negoriginalcom.com/watch.php?id=111443" title="Tharu Walalla 15-03-2018">Tharu Walalla 15-03-2018</a></div><div class="posted-time">Posted 2018-03-15<div class="posted-by">by <span class="poster">Col3neg</span></div></div><div class="video-views">Viewed 1739 times</div><div class="filter-show-link"><a href="more.php?show=604">view all items</a></div></div>
<div align="center" class="video-cell"><div class="video-thumb-wrapper"><a href="http://www.col3negoriginalcom.com/watch.php?id=111381" title="Tharu Walalla 14-03-2018"><img src="http://col3negoriginal.tv/img/category/tharu-walalla.jpg" alt="Tharu Walalla 14-03-2018" border="0" height="90" width="118"></a></div><div class="video-title"><a href="http://www.col3negoriginalcom.com/watch.php?id=111381" title="Tharu Walalla 14-03-2018">Tharu Walalla 14-03-2018</a></div><div class="posted-time">Posted 2018-03-14<div class="posted-by">by <span class="poster">Col3neg</span></div></div><div class="video-views">Viewed 1344 times</div><div class="filter-show-link"><a href="more.php?show=604">view all items</a></div></div>
<div align="center" class="video-cell"><div class="video-thumb-wrapper"><a href="http://www.col3negoriginalcom.com/watch.php?id=111313" title="Tharu Walalla 13-03-2018"><img src="http://col3negoriginal.tv/img/category/tharu-walalla.jpg" alt="Tharu Walalla 13-03-2018" border="0" height="90" width="118"></a></div><div class="video-title"><a href="http://www.col3negoriginalcom.com/watch.php?id=111313" title="Tharu Walalla 13-03-2018">Tharu Walalla 13-03-2018</a></div><div class="posted-time">Posted 2018-03-13<div class="posted-by">by <span class="poster">Col3neg</span></div></div><div class="video-views">Viewed 1185 times</div><div class="filter-show-link"><a href="more.php?show=604">view all items</a></div></div>
</td></tr></table></div></div><script> var current_page = 1; var total_pages = 3; var paramString_5 = "&cat=5"; function shift_page_5 ( delta ) { var page = current_page + delta; if ( page < 1 ) { page = total_pages } if ( page > total_pages ) { page = 1 } show_page_5( page ); } function show_page_5 ( pagenum ) { new Ajax.Updater( 'page_panels_5', 'cat_panel.php?page=' + pagenum + paramString_5 + "", { evalScripts: true }); current_page = pagenum; var counter = 0; $$('#page_links_5 a').each( function(el) { ( ++ counter == current_page ) ? el.addClassName('page_selected') : el.removeClassName('page_selected') } ); } </script>
<div id="col3negoriginal-playlist-5" class="vcat-main-title"><div class="contentHd"><div>MP 3 Audio</div></div></div><div class="vcat-cell"><div class="vcat-cell-header"><div class="vcat-cell-header-text"><span class="vcat-cell-title-text" id="page_links_5">Pages: <a href="./?page=1" onclick="show_page_5(1); return false" class="page_num page_selected">1</a>  <a href="./?page=2" onclick="show_page_5(2); return false" class="page_num">2</a> <a href="./?page=3" onclick="show_page_5(3); return false" class="page_num">3</a></span><span class="cat-search-link"><a href="more.php?cat=5">View all 9 items</a></span></div></div><div class="vcat-cell-body" id="page_panels_5"><table border="0" cellpadding="0" cellspacing="0"><tr><td><div align="center" class="video-cell"><div class="video-thumb-wrapper"><a href="http://www.col3negoriginalcom.com/watch.php?id=12290" title="Milton Mallawarachchi"><img src="http://col3negoriginal.tv/img/videos/1363420433298.jpg" alt="Milton Mallawarachchi" border="0" height="90" width="118"></a></div><div class="video-title"><a href="http://www.col3negoriginalcom.com/watch.php?id=12290" title="Milton Mallawarachchi">Milton Mallawarachchi</a></div><div class="posted-time">Posted 2013-03-16<div class="posted-by">by <span class="poster">Col3neg</span></div></div><div class="video-views">Viewed 292696 times</div><div class="filter-show-link"><a href="more.php?show=5">view all items</a></div></div>
<div align="center" class="video-cell"><div class="video-thumb-wrapper"><a href="http://www.col3negoriginalcom.com/watch.php?id=11995" title="Gini Malak - Kithssiri Jayasekara"><img src="http://col3negoriginal.tv/img/videos/1362914413721.jpg" alt="Gini Malak - Kithssiri Jayasekara" border="0" height="90" width="118"></a></div><div class="video-title"><a href="http://www.col3negoriginalcom.com/watch.php?id=11995" title="Gini Malak - Kithssiri Jayasekara">Gini Malak - Kithssiri Jayasekara</a></div><div class="posted-time">Posted 2013-03-10<div class="posted-by">by <span class="poster">Col3neg</span></div></div><div class="video-views">Viewed 163752 times</div><div class="filter-show-link"><a href="more.php?show=5">view all items</a></div></div>
<div align="center" class="video-cell"><div class="video-thumb-wrapper"><a href="http://www.col3negoriginalcom.com/watch.php?id=11994" title="Nil Induwara - Asankan Piyamntha"><img src="http://col3negoriginal.tv/img/videos/1362914321726.jpg" alt="Nil Induwara - Asankan Piyamntha" border="0" height="90" width="118"></a></div><div class="video-title"><a href="http://www.col3negoriginalcom.com/watch.php?id=11994" title="Nil Induwara - Asankan Piyamntha">Nil Induwara - Asankan Piyamntha</a></div><div class="posted-time">Posted 2013-03-10<div class="posted-by">by <span class="poster">Col3neg</span></div></div><div class="video-views">Viewed 246516 times</div><div class="filter-show-link"><a href="more.php?show=5">view all items</a></div></div>
<div align="center" class="video-cell"><div class="video-thumb-wrapper"><a href="http://www.col3negoriginalcom.com/watch.php?id=11993" title="Ei Dan Epa Wela -  H.R Jothypala"><img src="http://col3negoriginal.tv/img/videos/1362914294361.jpg" alt="Ei Dan Epa Wela -  H.R Jothypala" border="0" height="90" width="118"></a></div><div class="video-title"><a href="http://www.col3negoriginalcom.com/watch.php?id=11993" title="Ei Dan Epa Wela -  H.R Jothypala">Ei Dan Epa Wela -  H.R Jothypala</a></div><div class="posted-time">Posted 2013-03-10<div class="posted-by">by <span class="poster">Col3neg</span></div></div><div class="video-views">Viewed 296182 times</div><div class="filter-show-link"><a href="more.php?show=5">view all items</a></div></div>
</td></tr></table></div></div><script> var current_page = 1; var total_pages = 409; var paramString_6 = "&cat=6"; function shift_page_6 ( delta ) { var page = current_page + delta; if ( page < 1 ) { page = total_pages } if ( page > total_pages ) { page = 1 } show_page_6( page ); } function show_page_6 ( pagenum ) { new Ajax.Updater( 'page_panels_6', 'cat_panel.php?page=' + pagenum + paramString_6 + "", { evalScripts: true }); current_page = pagenum; var counter = 0; $$('#page_links_6 a').each( function(el) { ( ++ counter == current_page ) ? el.addClassName('page_selected') : el.removeClassName('page_selected') } ); } </script>
<div id="col3negoriginal-playlist-6" class="vcat-main-title"><div class="contentHd"><div>Sinhala Songs</div></div></div><div class="vcat-cell"><div class="vcat-cell-header"><div class="vcat-cell-header-text"><span class="vcat-cell-title-text" id="page_links_6">Pages: <a href="./?page=1" onclick="show_page_6(1); return false" class="page_num page_selected">1</a>  <a href="./?page=2" onclick="show_page_6(2); return false" class="page_num">2</a> <a href="./?page=3" onclick="show_page_6(3); return false" class="page_num">3</a></span><span class="cat-search-link"><a href="more.php?cat=6">View all 1633 items</a></span></div></div><div class="vcat-cell-body" id="page_panels_6"><table border="0" cellpadding="0" cellspacing="0"><tr><td><div align="center" class="video-cell"><div class="video-thumb-wrapper"><a href="http://www.col3negoriginalcom.com/watch.php?id=110347" title="Thamath Adare Nathnam - Raini Charuka"><img src="http://i.ytimg.com/vi/mikTTm7MXNY/default.jpg" alt="Thamath Adare Nathnam - Raini Charuka" border="0" height="90" width="118"></a></div><div class="video-title"><a href="http://www.col3negoriginalcom.com/watch.php?id=110347" title="Thamath Adare Nathnam - Raini Charuka">Thamath Adare Nathnam - Raini Charuka</a></div><div class="posted-time">Posted 2018-02-25<div class="posted-by">by <span class="poster">Col3neg</span></div></div><div class="video-views">Viewed 19014 times</div><div class="filter-show-link"><a href="more.php?show=6">view all items</a></div></div>
<div align="center" class="video-cell"><div class="video-thumb-wrapper"><a href="http://www.col3negoriginalcom.com/watch.php?id=110346" title="Sihinenwath - Roshan Buddhika"><img src="http://i.ytimg.com/vi/Wg-4eFPfcvQ/default.jpg" alt="Sihinenwath - Roshan Buddhika" border="0" height="90" width="118"></a></div><div class="video-title"><a href="http://www.col3negoriginalcom.com/watch.php?id=110346" title="Sihinenwath - Roshan Buddhika">Sihinenwath - Roshan Buddhika</a></div><div class="posted-time">Posted 2018-02-25<div class="posted-by">by <span class="poster">Col3neg</span></div></div><div class="video-views">Viewed 8223 times</div><div class="filter-show-link"><a href="more.php?show=6">view all items</a></div></div>
<div align="center" class="video-cell"><div class="video-thumb-wrapper"><a href="http://www.col3negoriginalcom.com/watch.php?id=110345" title="Maa Dawa - Nuwan Deshapriya"><img src="http://i.ytimg.com/vi/_fIKceL1bnQ/default.jpg" alt="Maa Dawa - Nuwan Deshapriya" border="0" height="90" width="118"></a></div><div class="video-title"><a href="http://www.col3negoriginalcom.com/watch.php?id=110345" title="Maa Dawa - Nuwan Deshapriya">Maa Dawa - Nuwan Deshapriya</a></div><div class="posted-time">Posted 2018-02-25<div class="posted-by">by <span class="poster">Col3neg</span></div></div><div class="video-views">Viewed 6217 times</div><div class="filter-show-link"><a href="more.php?show=6">view all items</a></div></div>
<div align="center" class="video-cell"><div class="video-thumb-wrapper"><a href="http://www.col3negoriginalcom.com/watch.php?id=107701" title="Maga Nodana (Ingi Bingi Sena) - Deweni Inima Teledrama Song - Various Artists"><img src="http://i.ytimg.com/vi/dY8PR6XuKQk/default.jpg" alt="Maga Nodana (Ingi Bingi Sena) - Deweni Inima Teledrama Song - Various Artists" border="0" height="90" width="118"></a></div><div class="video-title"><a href="http://www.col3negoriginalcom.com/watch.php?id=107701" title="Maga Nodana (Ingi Bingi Sena) - Deweni Inima Teledrama Song - Various Artists">Maga Nodana (Ingi Bingi Sena) - Deweni Inima Teledrama Song - Various Artists</a></div><div class="posted-time">Posted 2018-01-14<div class="posted-by">by <span class="poster">Col3neg</span></div></div><div class="video-views">Viewed 52507 times</div><div class="filter-show-link"><a href="more.php?show=6">view all items</a></div></div>
</td></tr></table></div></div><script> var current_page = 1; var total_pages = 138; var paramString_7 = "&cat=7"; function shift_page_7 ( delta ) { var page = current_page + delta; if ( page < 1 ) { page = total_pages } if ( page > total_pages ) { page = 1 } show_page_7( page ); } function show_page_7 ( pagenum ) { new Ajax.Updater( 'page_panels_7', 'cat_panel.php?page=' + pagenum + paramString_7 + "", { evalScripts: true }); current_page = pagenum; var counter = 0; $$('#page_links_7 a').each( function(el) { ( ++ counter == current_page ) ? el.addClassName('page_selected') : el.removeClassName('page_selected') } ); } </script>
<div id="col3negoriginal-playlist-7" class="vcat-main-title"><div class="contentHd"><div>Live Shows</div></div></div><div class="vcat-cell"><div class="vcat-cell-header"><div class="vcat-cell-header-text"><span class="vcat-cell-title-text" id="page_links_7">Pages: <a href="./?page=1" onclick="show_page_7(1); return false" class="page_num page_selected">1</a>  <a href="./?page=2" onclick="show_page_7(2); return false" class="page_num">2</a> <a href="./?page=3" onclick="show_page_7(3); return false" class="page_num">3</a></span><span class="cat-search-link"><a href="more.php?cat=7">View all 549 items</a></span></div></div><div class="vcat-cell-body" id="page_panels_7"><table border="0" cellpadding="0" cellspacing="0"><tr><td><div align="center" class="video-cell"><div class="video-thumb-wrapper"><a href="http://www.col3negoriginalcom.com/watch.php?id=111179" title="Hiru Mega Blast Live - Athurugiriya 10-03-2018"><img src="http://i.ytimg.com/vi/AqoSeRNmLAE/default.jpg" alt="Hiru Mega Blast Live - Athurugiriya 10-03-2018" border="0" height="90" width="118"></a></div><div class="video-title"><a href="http://www.col3negoriginalcom.com/watch.php?id=111179" title="Hiru Mega Blast Live - Athurugiriya 10-03-2018">Hiru Mega Blast Live - Athurugiriya 10-03-2018</a></div><div class="posted-time">Posted 2018-03-10<div class="posted-by">by <span class="poster">Col3neg</span></div></div><div class="video-views">Viewed 6506 times</div><div class="filter-show-link"><a href="more.php?show=7">view all items</a></div></div>
<div align="center" class="video-cell"><div class="video-thumb-wrapper"><a href="http://www.col3negoriginalcom.com/watch.php?id=110344" title="SunFlower 2017 Thaldeka"><img src="https://i.ytimg.com/vi/8P3rCyzQMM4/hqdefault.jpg" alt="SunFlower 2017 Thaldeka" border="0" height="90" width="118"></a></div><div class="video-title"><a href="http://www.col3negoriginalcom.com/watch.php?id=110344" title="SunFlower 2017 Thaldeka">SunFlower 2017 Thaldeka</a></div><div class="posted-time">Posted 2018-02-25<div class="posted-by">by <span class="poster">Col3neg</span></div></div><div class="video-views">Viewed 11612 times</div><div class="filter-show-link"><a href="more.php?show=7">view all items</a></div></div>
<div align="center" class="video-cell"><div class="video-thumb-wrapper"><a href="http://www.col3negoriginalcom.com/watch.php?id=110343" title="Flash Back 2018 Ambalangoda"><img src="https://i.ytimg.com/vi/VInGepYCNQ0/hqdefault.jpg" alt="Flash Back 2018 Ambalangoda" border="0" height="90" width="118"></a></div><div class="video-title"><a href="http://www.col3negoriginalcom.com/watch.php?id=110343" title="Flash Back 2018 Ambalangoda">Flash Back 2018 Ambalangoda</a></div><div class="posted-time">Posted 2018-02-25<div class="posted-by">by <span class="poster">Col3neg</span></div></div><div class="video-views">Viewed 8546 times</div><div class="filter-show-link"><a href="more.php?show=7">view all items</a></div></div>
<div align="center" class="video-cell"><div class="video-thumb-wrapper"><a href="http://www.col3negoriginalcom.com/watch.php?id=110342" title="Oxygen 2018 Bingiriya"><img src="https://i.ytimg.com/vi/66_YIzskGjE/hqdefault.jpg" alt="Oxygen 2018 Bingiriya" border="0" height="90" width="118"></a></div><div class="video-title"><a href="http://www.col3negoriginalcom.com/watch.php?id=110342" title="Oxygen 2018 Bingiriya">Oxygen 2018 Bingiriya</a></div><div class="posted-time">Posted 2018-02-25<div class="posted-by">by <span class="poster">Col3neg</span></div></div><div class="video-views">Viewed 5777 times</div><div class="filter-show-link"><a href="more.php?show=7">view all items</a></div></div>
</td></tr></table></div></div><script> var current_page = 1; var total_pages = 1142; var paramString_662 = "&cat=662"; function shift_page_662 ( delta ) { var page = current_page + delta; if ( page < 1 ) { page = total_pages } if ( page > total_pages ) { page = 1 } show_page_662( page ); } function show_page_662 ( pagenum ) { new Ajax.Updater( 'page_panels_662', 'cat_panel.php?page=' + pagenum + paramString_662 + "", { evalScripts: true }); current_page = pagenum; var counter = 0; $$('#page_links_662 a').each( function(el) { ( ++ counter == current_page ) ? el.addClassName('page_selected') : el.removeClassName('page_selected') } ); } </script>
<div id="col3negoriginal-playlist-662" class="vcat-main-title"><div class="contentHd"><div>Sinhala Dubbed Teledramas</div></div></div><div class="vcat-cell"><div class="vcat-cell-header"><div class="vcat-cell-header-text"><span class="vcat-cell-title-text" id="page_links_662">Pages: <a href="./?page=1" onclick="show_page_662(1); return false" class="page_num page_selected">1</a>  <a href="./?page=2" onclick="show_page_662(2); return false" class="page_num">2</a> <a href="./?page=3" onclick="show_page_662(3); return false" class="page_num">3</a></span><span class="cat-search-link"><a href="more.php?cat=662">View all 4567 items</a></span></div></div><div class="vcat-cell-body" id="page_panels_662"><table border="0" cellpadding="0" cellspacing="0"><tr><td><div align="center" class="video-cell"><div class="video-thumb-wrapper"><a href="http://www.col3negoriginalcom.com/watch.php?id=111550" title="Sandata Diwura Kiyannam (23) - 16-03-2018"><img src="http://col3negoriginal.tv/img/category/sandata-diwura-kiyannam-teledrama.jpg" alt="Sandata Diwura Kiyannam (23) - 16-03-2018" border="0" height="90" width="118"></a></div><div class="video-title"><a href="http://www.col3negoriginalcom.com/watch.php?id=111550" title="Sandata Diwura Kiyannam (23) - 16-03-2018">Sandata Diwura Kiyannam (23) - 16-03-2018</a></div><div class="posted-time">Posted 2018-03-16<div class="posted-by">by <span class="poster">Col3neg</span></div></div><div class="video-views">Viewed 1929 times</div><div class="filter-show-link"><a href="more.php?show=883">view all items</a></div></div>
<div align="center" class="video-cell"><div class="video-thumb-wrapper"><a href="http://www.col3negoriginalcom.com/watch.php?id=111543" title="Thamath Aadare Nethnam (20) - 16-03-2018"><img src="http://col3negoriginal.tv/img/category/thamath-adare-nethnam-teledrama.jpg" alt="Thamath Aadare Nethnam (20) - 16-03-2018" border="0" height="90" width="118"></a></div><div class="video-title"><a href="http://www.col3negoriginalcom.com/watch.php?id=111543" title="Thamath Aadare Nethnam (20) - 16-03-2018">Thamath Aadare Nethnam (20) - 16-03-2018</a></div><div class="posted-time">Posted 2018-03-16<div class="posted-by">by <span class="poster">Col3neg</span></div></div><div class="video-views">Viewed 3139 times</div><div class="filter-show-link"><a href="more.php?show=913">view all items</a></div></div>
<div align="center" class="video-cell"><div class="video-thumb-wrapper"><a href="http://www.col3negoriginalcom.com/watch.php?id=111542" title="Me Adarayai (1003) - 16-03-2018"><img src="http://col3negoriginal.tv/img/category/me-adarayai-tele-drama.jpg" alt="Me Adarayai (1003) - 16-03-2018" border="0" height="90" width="118"></a></div><div class="video-title"><a href="http://www.col3negoriginalcom.com/watch.php?id=111542" title="Me Adarayai (1003) - 16-03-2018">Me Adarayai (1003) - 16-03-2018</a></div><div class="posted-time">Posted 2018-03-16<div class="posted-by">by <span class="poster">Col3neg</span></div></div><div class="video-views">Viewed 6977 times</div><div class="filter-show-link"><a href="more.php?show=371">view all items</a></div></div>
<div align="center" class="video-cell"><div class="video-thumb-wrapper"><a href="http://www.col3negoriginalcom.com/watch.php?id=111541" title="Adarei Man Adarei (598) - 16-03-2018"><img src="http://col3negoriginal.tv/img/category/adarei-man-adarei-tele-drama.jpg" alt="Adarei Man Adarei (598) - 16-03-2018" border="0" height="90" width="118"></a></div><div class="video-title"><a href="http://www.col3negoriginalcom.com/watch.php?id=111541" title="Adarei Man Adarei (598) - 16-03-2018">Adarei Man Adarei (598) - 16-03-2018</a></div><div class="posted-time">Posted 2018-03-16<div class="posted-by">by <span class="poster">Col3neg</span></div></div><div class="video-views">Viewed 3686 times</div><div class="filter-show-link"><a href="more.php?show=557">view all items</a></div></div>
<div align="center" class="video-cell"><div class="video-thumb-wrapper"><a href="http://www.col3negoriginalcom.com/watch.php?id=111539" title="Obath Mamath Ayath (75) - 16-03-2018"><img src="http://col3negoriginal.tv/img/category/obath-mamath-ayath-teledrama.jpg" alt="Obath Mamath Ayath (75) - 16-03-2018" border="0" height="90" width="118"></a></div><div class="video-title"><a href="http://www.col3negoriginalcom.com/watch.php?id=111539" title="Obath Mamath Ayath (75) - 16-03-2018">Obath Mamath Ayath (75) - 16-03-2018</a></div><div class="posted-time">Posted 2018-03-16<div class="posted-by">by <span class="poster">Col3neg</span></div></div><div class="video-views">Viewed 2975 times</div><div class="filter-show-link"><a href="more.php?show=875">view all items</a></div></div>
<div align="center" class="video-cell"><div class="video-thumb-wrapper"><a href="http://www.col3negoriginalcom.com/watch.php?id=111535" title="Chandra Nandani (149) - 16-03-2018"><img src="http://col3negoriginal.tv/img/category/chandra-nandani-teledrama.jpg" alt="Chandra Nandani (149) - 16-03-2018" border="0" height="90" width="118"></a></div><div class="video-title"><a href="http://www.col3negoriginalcom.com/watch.php?id=111535" title="Chandra Nandani (149) - 16-03-2018">Chandra Nandani (149) - 16-03-2018</a></div><div class="posted-time">Posted 2018-03-16<div class="posted-by">by <span class="poster">Col3neg</span></div></div><div class="video-views">Viewed 3055 times</div><div class="filter-show-link"><a href="more.php?show=829">view all items</a></div></div>
<div align="center" class="video-cell"><div class="video-thumb-wrapper"><a href="http://www.col3negoriginalcom.com/watch.php?id=111532" title="Saraswathichandra (87) - 16-03-2018"><img src="http://col3negoriginal.tv/img/category/saraswathichandra.jpg" alt="Saraswathichandra (87) - 16-03-2018" border="0" height="90" width="118"></a></div><div class="video-title"><a href="http://www.col3negoriginalcom.com/watch.php?id=111532" title="Saraswathichandra (87) - 16-03-2018">Saraswathichandra (87) - 16-03-2018</a></div><div class="posted-time">Posted 2018-03-16<div class="posted-by">by <span class="poster">Col3neg</span></div></div><div class="video-views">Viewed 2017 times</div><div class="filter-show-link"><a href="more.php?show=864">view all items</a></div></div>
<div align="center" class="video-cell"><div class="video-thumb-wrapper"><a href="http://www.col3negoriginalcom.com/watch.php?id=111529" title="Shiwani (5) - 16-03-2018"><img src="http://col3negoriginal.tv/img/category/shiwani-teledrama.jpg" alt="Shiwani (5) - 16-03-2018" border="0" height="90" width="118"></a></div><div class="video-title"><a href="http://www.col3negoriginalcom.com/watch.php?id=111529" title="Shiwani (5) - 16-03-2018">Shiwani (5) - 16-03-2018</a></div><div class="posted-time">Posted 2018-03-16<div class="posted-by">by <span class="poster">Col3neg</span></div></div><div class="video-views">Viewed 1505 times</div><div class="filter-show-link"><a href="more.php?show=916">view all items</a></div></div>
<div align="center" class="video-cell"><div class="video-thumb-wrapper"><a href="http://www.col3negoriginalcom.com/watch.php?id=111527" title="Swapna 16-03-2018"><img src="http://col3negoriginal.tv/img/category/swapna-tele-drama.jpg" alt="Swapna 16-03-2018" border="0" height="90" width="118"></a></div><div class="video-title"><a href="http://www.col3negoriginalcom.com/watch.php?id=111527" title="Swapna 16-03-2018">Swapna 16-03-2018</a></div><div class="posted-time">Posted 2018-03-16<div class="posted-by">by <span class="poster">Col3neg</span></div></div><div class="video-views">Viewed 5773 times</div><div class="filter-show-link"><a href="more.php?show=262">view all items</a></div></div>
<div align="center" class="video-cell"><div class="video-thumb-wrapper"><a href="http://www.col3negoriginalcom.com/watch.php?id=111526" title="Soorayangeth Sooraya (452) - 16-03-2018"><img src="http://col3negoriginal.tv/img/category/soorayangeth-sooraya-tele-drama.jpg" alt="Soorayangeth Sooraya (452) - 16-03-2018" border="0" height="90" width="118"></a></div><div class="video-title"><a href="http://www.col3negoriginalcom.com/watch.php?id=111526" title="Soorayangeth Sooraya (452) - 16-03-2018">Soorayangeth Sooraya (452) - 16-03-2018</a></div><div class="posted-time">Posted 2018-03-16<div class="posted-by">by <span class="poster">Col3neg</span></div></div><div class="video-views">Viewed 685 times</div><div class="filter-show-link"><a href="more.php?show=614">view all items</a></div></div>
<div align="center" class="video-cell"><div class="video-thumb-wrapper"><a href="http://www.col3negoriginalcom.com/watch.php?id=111520" title="Heenayakda Me (188) - 16-03-2018"><img src="http://col3negoriginal.tv/img/category/heenayakda-me-teledrama.jpg" alt="Heenayakda Me (188) - 16-03-2018" border="0" height="90" width="118"></a></div><div class="video-title"><a href="http://www.col3negoriginalcom.com/watch.php?id=111520" title="Heenayakda Me (188) - 16-03-2018">Heenayakda Me (188) - 16-03-2018</a></div><div class="posted-time">Posted 2018-03-16<div class="posted-by">by <span class="poster">Col3neg</span></div></div><div class="video-views">Viewed 1065 times</div><div class="filter-show-link"><a href="more.php?show=809">view all items</a></div></div>
<div align="center" class="video-cell"><div class="video-thumb-wrapper"><a href="http://www.col3negoriginalcom.com/watch.php?id=111517" title="Me Mage Sihinayai (137) - 16-03-2018"><img src="http://col3negoriginal.tv/img/category/me-mage-sihinayai-teledrama.jpg" alt="Me Mage Sihinayai (137) - 16-03-2018" border="0" height="90" width="118"></a></div><div class="video-title"><a href="http://www.col3negoriginalcom.com/watch.php?id=111517" title="Me Mage Sihinayai (137) - 16-03-2018">Me Mage Sihinayai (137) - 16-03-2018</a></div><div class="posted-time">Posted 2018-03-16<div class="posted-by">by <span class="poster">Col3neg</span></div></div><div class="video-views">Viewed 1703 times</div><div class="filter-show-link"><a href="more.php?show=835">view all items</a></div></div>
</td></tr></table></div></div><script> var current_page = 1; var total_pages = 317; var paramString_663 = "&cat=663"; function shift_page_663 ( delta ) { var page = current_page + delta; if ( page < 1 ) { page = total_pages } if ( page > total_pages ) { page = 1 } show_page_663( page ); } function show_page_663 ( pagenum ) { new Ajax.Updater( 'page_panels_663', 'cat_panel.php?page=' + pagenum + paramString_663 + "", { evalScripts: true }); current_page = pagenum; var counter = 0; $$('#page_links_663 a').each( function(el) { ( ++ counter == current_page ) ? el.addClassName('page_selected') : el.removeClassName('page_selected') } ); } </script>
<div id="col3negoriginal-playlist-663" class="vcat-main-title"><div class="contentHd"><div>Weekend Teledramas</div></div></div><div class="vcat-cell"><div class="vcat-cell-header"><div class="vcat-cell-header-text"><span class="vcat-cell-title-text" id="page_links_663">Pages: <a href="./?page=1" onclick="show_page_663(1); return false" class="page_num page_selected">1</a>  <a href="./?page=2" onclick="show_page_663(2); return false" class="page_num">2</a> <a href="./?page=3" onclick="show_page_663(3); return false" class="page_num">3</a></span><span class="cat-search-link"><a href="more.php?cat=663">View all 1266 items</a></span></div></div><div class="vcat-cell-body" id="page_panels_663"><table border="0" cellpadding="0" cellspacing="0"><tr><td><div align="center" class="video-cell"><div class="video-thumb-wrapper"><a href="http://www.col3negoriginalcom.com/watch.php?id=111549" title="Paali (29) - 16-03-2018"><img src="http://col3negoriginal.tv/img/category/paali-teledrama.jpg" alt="Paali (29) - 16-03-2018" border="0" height="90" width="118"></a></div><div class="video-title"><a href="http://www.col3negoriginalcom.com/watch.php?id=111549" title="Paali (29) - 16-03-2018">Paali (29) - 16-03-2018</a></div><div class="posted-time">Posted 2018-03-16<div class="posted-by">by <span class="poster">Col3neg</span></div></div><div class="video-views">Viewed 3665 times</div><div class="filter-show-link"><a href="more.php?show=882">view all items</a></div></div>
<div align="center" class="video-cell"><div class="video-thumb-wrapper"><a href="http://www.col3negoriginalcom.com/watch.php?id=111492" title="Paali (28) - 15-03-2018"><img src="http://col3negoriginal.tv/img/category/paali-teledrama.jpg" alt="Paali (28) - 15-03-2018" border="0" height="90" width="118"></a></div><div class="video-title"><a href="http://www.col3negoriginalcom.com/watch.php?id=111492" title="Paali (28) - 15-03-2018">Paali (28) - 15-03-2018</a></div><div class="posted-time">Posted 2018-03-15<div class="posted-by">by <span class="poster">Col3neg</span></div></div><div class="video-views">Viewed 5832 times</div><div class="filter-show-link"><a href="more.php?show=882">view all items</a></div></div>
<div align="center" class="video-cell"><div class="video-thumb-wrapper"><a href="http://www.col3negoriginalcom.com/watch.php?id=111433" title="Paali (27) - 14-03-2018"><img src="http://col3negoriginal.tv/img/category/paali-teledrama.jpg" alt="Paali (27) - 14-03-2018" border="0" height="90" width="118"></a></div><div class="video-title"><a href="http://www.col3negoriginalcom.com/watch.php?id=111433" title="Paali (27) - 14-03-2018">Paali (27) - 14-03-2018</a></div><div class="posted-time">Posted 2018-03-14<div class="posted-by">by <span class="poster">Col3neg</span></div></div><div class="video-views">Viewed 8334 times</div><div class="filter-show-link"><a href="more.php?show=882">view all items</a></div></div>
<div align="center" class="video-cell"><div class="video-thumb-wrapper"><a href="http://www.col3negoriginalcom.com/watch.php?id=111370" title="Paali (26) - 13-03-2018"><img src="http://col3negoriginal.tv/img/category/paali-teledrama.jpg" alt="Paali (26) - 13-03-2018" border="0" height="90" width="118"></a></div><div class="video-title"><a href="http://www.col3negoriginalcom.com/watch.php?id=111370" title="Paali (26) - 13-03-2018">Paali (26) - 13-03-2018</a></div><div class="posted-time">Posted 2018-03-13<div class="posted-by">by <span class="poster">Col3neg</span></div></div><div class="video-views">Viewed 7462 times</div><div class="filter-show-link"><a href="more.php?show=882">view all items</a></div></div>
<div align="center" class="video-cell"><div class="video-thumb-wrapper"><a href="http://www.col3negoriginalcom.com/watch.php?id=111282" title="Paali (25) - 12-03-2018"><img src="http://col3negoriginal.tv/img/category/paali-teledrama.jpg" alt="Paali (25) - 12-03-2018" border="0" height="90" width="118"></a></div><div class="video-title"><a href="http://www.col3negoriginalcom.com/watch.php?id=111282" title="Paali (25) - 12-03-2018">Paali (25) - 12-03-2018</a></div><div class="posted-time">Posted 2018-03-12<div class="posted-by">by <span class="poster">Col3neg</span></div></div><div class="video-views">Viewed 10242 times</div><div class="filter-show-link"><a href="more.php?show=882">view all items</a></div></div>
<div align="center" class="video-cell"><div class="video-thumb-wrapper"><a href="http://www.col3negoriginalcom.com/watch.php?id=111208" title="Adarawanthiyo (35) - 11-03-2018"><img src="http://col3negoriginal.tv/img/category/adarawanthiyo-teledrama.jpg" alt="Adarawanthiyo (35) - 11-03-2018" border="0" height="90" width="118"></a></div><div class="video-title"><a href="http://www.col3negoriginalcom.com/watch.php?id=111208" title="Adarawanthiyo (35) - 11-03-2018">Adarawanthiyo (35) - 11-03-2018</a></div><div class="posted-time">Posted 2018-03-11<div class="posted-by">by <span class="poster">Col3neg</span></div></div><div class="video-views">Viewed 6173 times</div><div class="filter-show-link"><a href="more.php?show=872">view all items</a></div></div>
<div align="center" class="video-cell"><div class="video-thumb-wrapper"><a href="http://www.col3negoriginalcom.com/watch.php?id=111198" title="Medi Sina 11-03-2018"><img src="http://col3negoriginal.tv/img/category/medi-sina-tele-drama.jpg" alt="Medi Sina 11-03-2018" border="0" height="90" width="118"></a></div><div class="video-title"><a href="http://www.col3negoriginalcom.com/watch.php?id=111198" title="Medi Sina 11-03-2018">Medi Sina 11-03-2018</a></div><div class="posted-time">Posted 2018-03-11<div class="posted-by">by <span class="poster">Col3neg</span></div></div><div class="video-views">Viewed 8899 times</div><div class="filter-show-link"><a href="more.php?show=590">view all items</a></div></div>
<div align="center" class="video-cell"><div class="video-thumb-wrapper"><a href="http://www.col3negoriginalcom.com/watch.php?id=111197" title="Hulan Gedara (43) - 11-03-2018"><img src="http://col3negoriginal.tv/img/category/hulan-gedara-teledrama.jpg" alt="Hulan Gedara (43) - 11-03-2018" border="0" height="90" width="118"></a></div><div class="video-title"><a href="http://www.col3negoriginalcom.com/watch.php?id=111197" title="Hulan Gedara (43) - 11-03-2018">Hulan Gedara (43) - 11-03-2018</a></div><div class="posted-time">Posted 2018-03-11<div class="posted-by">by <span class="poster">Col3neg</span></div></div><div class="video-views">Viewed 15744 times</div><div class="filter-show-link"><a href="more.php?show=837">view all items</a></div></div>
</td></tr></table></div></div><script> var current_page = 1; var total_pages = 245; var paramString_664 = "&cat=664"; function shift_page_664 ( delta ) { var page = current_page + delta; if ( page < 1 ) { page = total_pages } if ( page > total_pages ) { page = 1 } show_page_664( page ); } function show_page_664 ( pagenum ) { new Ajax.Updater( 'page_panels_664', 'cat_panel.php?page=' + pagenum + paramString_664 + "", { evalScripts: true }); current_page = pagenum; var counter = 0; $$('#page_links_664 a').each( function(el) { ( ++ counter == current_page ) ? el.addClassName('page_selected') : el.removeClassName('page_selected') } ); } </script>
<div id="col3negoriginal-playlist-664" class="vcat-main-title"><div class="contentHd"><div>Saturday Teledramas</div></div></div><div class="vcat-cell"><div class="vcat-cell-header"><div class="vcat-cell-header-text"><span class="vcat-cell-title-text" id="page_links_664">Pages: <a href="./?page=1" onclick="show_page_664(1); return false" class="page_num page_selected">1</a>  <a href="./?page=2" onclick="show_page_664(2); return false" class="page_num">2</a> <a href="./?page=3" onclick="show_page_664(3); return false" class="page_num">3</a></span><span class="cat-search-link"><a href="more.php?cat=664">View all 978 items</a></span></div></div><div class="vcat-cell-body" id="page_panels_664"><table border="0" cellpadding="0" cellspacing="0"><tr><td><div align="center" class="video-cell"><div class="video-thumb-wrapper"><a href="http://www.col3negoriginalcom.com/watch.php?id=111172" title="Nathaliya (8) - 10-03-2018"><img src="http://col3negoriginal.tv/img/category/nathaliya-teledrama.jpg" alt="Nathaliya (8) - 10-03-2018" border="0" height="90" width="118"></a></div><div class="video-title"><a href="http://www.col3negoriginalcom.com/watch.php?id=111172" title="Nathaliya (8) - 10-03-2018">Nathaliya (8) - 10-03-2018</a></div><div class="posted-time">Posted 2018-03-10<div class="posted-by">by <span class="poster">Col3neg</span></div></div><div class="video-views">Viewed 5166 times</div><div class="filter-show-link"><a href="more.php?show=908">view all items</a></div></div>
<div align="center" class="video-cell"><div class="video-thumb-wrapper"><a href="http://www.col3negoriginalcom.com/watch.php?id=110747" title="Nathaliya (7) - 03-03-2018"><img src="http://col3negoriginal.tv/img/category/nathaliya-teledrama.jpg" alt="Nathaliya (7) - 03-03-2018" border="0" height="90" width="118"></a></div><div class="video-title"><a href="http://www.col3negoriginalcom.com/watch.php?id=110747" title="Nathaliya (7) - 03-03-2018">Nathaliya (7) - 03-03-2018</a></div><div class="posted-time">Posted 2018-03-3<div class="posted-by">by <span class="poster">Col3neg</span></div></div><div class="video-views">Viewed 6049 times</div><div class="filter-show-link"><a href="more.php?show=908">view all items</a></div></div>
<div align="center" class="video-cell"><div class="video-thumb-wrapper"><a href="http://www.col3negoriginalcom.com/watch.php?id=110287" title="Nathaliya (6) - 24-02-2018"><img src="http://col3negoriginal.tv/img/category/nathaliya-teledrama.jpg" alt="Nathaliya (6) - 24-02-2018" border="0" height="90" width="118"></a></div><div class="video-title"><a href="http://www.col3negoriginalcom.com/watch.php?id=110287" title="Nathaliya (6) - 24-02-2018">Nathaliya (6) - 24-02-2018</a></div><div class="posted-time">Posted 2018-02-24<div class="posted-by">by <span class="poster">Col3neg</span></div></div><div class="video-views">Viewed 7823 times</div><div class="filter-show-link"><a href="more.php?show=908">view all items</a></div></div>
<div align="center" class="video-cell"><div class="video-thumb-wrapper"><a href="http://www.col3negoriginalcom.com/watch.php?id=109856" title="Nathaliya (5) - 17-02-2018"><img src="http://col3negoriginal.tv/img/category/nathaliya-teledrama.jpg" alt="Nathaliya (5) - 17-02-2018" border="0" height="90" width="118"></a></div><div class="video-title"><a href="http://www.col3negoriginalcom.com/watch.php?id=109856" title="Nathaliya (5) - 17-02-2018">Nathaliya (5) - 17-02-2018</a></div><div class="posted-time">Posted 2018-02-17<div class="posted-by">by <span class="poster">Col3neg</span></div></div><div class="video-views">Viewed 11138 times</div><div class="filter-show-link"><a href="more.php?show=908">view all items</a></div></div>
</td></tr></table></div></div><script> var current_page = 1; var total_pages = 233; var paramString_665 = "&cat=665"; function shift_page_665 ( delta ) { var page = current_page + delta; if ( page < 1 ) { page = total_pages } if ( page > total_pages ) { page = 1 } show_page_665( page ); } function show_page_665 ( pagenum ) { new Ajax.Updater( 'page_panels_665', 'cat_panel.php?page=' + pagenum + paramString_665 + "", { evalScripts: true }); current_page = pagenum; var counter = 0; $$('#page_links_665 a').each( function(el) { ( ++ counter == current_page ) ? el.addClassName('page_selected') : el.removeClassName('page_selected') } ); } </script>
<div id="col3negoriginal-playlist-665" class="vcat-main-title"><div class="contentHd"><div>Sunday Teledramas</div></div></div><div class="vcat-cell"><div class="vcat-cell-header"><div class="vcat-cell-header-text"><span class="vcat-cell-title-text" id="page_links_665">Pages: <a href="./?page=1" onclick="show_page_665(1); return false" class="page_num page_selected">1</a>  <a href="./?page=2" onclick="show_page_665(2); return false" class="page_num">2</a> <a href="./?page=3" onclick="show_page_665(3); return false" class="page_num">3</a></span><span class="cat-search-link"><a href="more.php?cat=665">View all 930 items</a></span></div></div><div class="vcat-cell-body" id="page_panels_665"><table border="0" cellpadding="0" cellspacing="0"><tr><td><div align="center" class="video-cell"><div class="video-thumb-wrapper"><a href="http://www.col3negoriginalcom.com/watch.php?id=111211" title="Ranhiru Ras (27) - 11-03-2018"><img src="http://col3negoriginal.tv/img/category/ranhiru-ras-teledrama.jpg" alt="Ranhiru Ras (27) - 11-03-2018" border="0" height="90" width="118"></a></div><div class="video-title"><a href="http://www.col3negoriginalcom.com/watch.php?id=111211" title="Ranhiru Ras (27) - 11-03-2018">Ranhiru Ras (27) - 11-03-2018</a></div><div class="posted-time">Posted 2018-03-11<div class="posted-by">by <span class="poster">Col3neg</span></div></div><div class="video-views">Viewed 2157 times</div><div class="filter-show-link"><a href="more.php?show=834">view all items</a></div></div>
<div align="center" class="video-cell"><div class="video-thumb-wrapper"><a href="http://www.col3negoriginalcom.com/watch.php?id=111204" title="Wamana Yamaya (34) - 11-03-2018"><img src="http://col3negoriginal.tv/img/category/wamana-yamaya-teledrama.jpg" alt="Wamana Yamaya (34) - 11-03-2018" border="0" height="90" width="118"></a></div><div class="video-title"><a href="http://www.col3negoriginalcom.com/watch.php?id=111204" title="Wamana Yamaya (34) - 11-03-2018">Wamana Yamaya (34) - 11-03-2018</a></div><div class="posted-time">Posted 2018-03-11<div class="posted-by">by <span class="poster">Col3neg</span></div></div><div class="video-views">Viewed 4018 times</div><div class="filter-show-link"><a href="more.php?show=813">view all items</a></div></div>
<div align="center" class="video-cell"><div class="video-thumb-wrapper"><a href="http://www.col3negoriginalcom.com/watch.php?id=111203" title="Mahee Pooja (56) - 11-03-2018"><img src="http://col3negoriginal.tv/img/category/mahee-pooja-teledrama.jpg" alt="Mahee Pooja (56) - 11-03-2018" border="0" height="90" width="118"></a></div><div class="video-title"><a href="http://www.col3negoriginalcom.com/watch.php?id=111203" title="Mahee Pooja (56) - 11-03-2018">Mahee Pooja (56) - 11-03-2018</a></div><div class="posted-time">Posted 2018-03-11<div class="posted-by">by <span class="poster">Col3neg</span></div></div><div class="video-views">Viewed 4311 times</div><div class="filter-show-link"><a href="more.php?show=774">view all items</a></div></div>
<div align="center" class="video-cell"><div class="video-thumb-wrapper"><a href="http://www.col3negoriginalcom.com/watch.php?id=110802" title="Wamana Yamaya (32) - 04-03-2018"><img src="http://col3negoriginal.tv/img/category/wamana-yamaya-teledrama.jpg" alt="Wamana Yamaya (32) - 04-03-2018" border="0" height="90" width="118"></a></div><div class="video-title"><a href="http://www.col3negoriginalcom.com/watch.php?id=110802" title="Wamana Yamaya (32) - 04-03-2018">Wamana Yamaya (32) - 04-03-2018</a></div><div class="posted-time">Posted 2018-03-4<div class="posted-by">by <span class="poster">Col3neg</span></div></div><div class="video-views">Viewed 5225 times</div><div class="filter-show-link"><a href="more.php?show=813">view all items</a></div></div>
<div align="center" class="video-cell"><div class="video-thumb-wrapper"><a href="http://www.col3negoriginalcom.com/watch.php?id=110800" title="Ranhiru Ras (26) - 04-03-2018"><img src="http://col3negoriginal.tv/img/category/ranhiru-ras-teledrama.jpg" alt="Ranhiru Ras (26) - 04-03-2018" border="0" height="90" width="118"></a></div><div class="video-title"><a href="http://www.col3negoriginalcom.com/watch.php?id=110800" title="Ranhiru Ras (26) - 04-03-2018">Ranhiru Ras (26) - 04-03-2018</a></div><div class="posted-time">Posted 2018-03-4<div class="posted-by">by <span class="poster">Col3neg</span></div></div><div class="video-views">Viewed 2930 times</div><div class="filter-show-link"><a href="more.php?show=834">view all items</a></div></div>
<div align="center" class="video-cell"><div class="video-thumb-wrapper"><a href="http://www.col3negoriginalcom.com/watch.php?id=110789" title="Mahee Pooja (55) - 04-03-2018"><img src="http://col3negoriginal.tv/img/category/mahee-pooja-teledrama.jpg" alt="Mahee Pooja (55) - 04-03-2018" border="0" height="90" width="118"></a></div><div class="video-title"><a href="http://www.col3negoriginalcom.com/watch.php?id=110789" title="Mahee Pooja (55) - 04-03-2018">Mahee Pooja (55) - 04-03-2018</a></div><div class="posted-time">Posted 2018-03-4<div class="posted-by">by <span class="poster">Col3neg</span></div></div><div class="video-views">Viewed 5051 times</div><div class="filter-show-link"><a href="more.php?show=774">view all items</a></div></div>
<div align="center" class="video-cell"><div class="video-thumb-wrapper"><a href="http://www.col3negoriginalcom.com/watch.php?id=110724" title="Mahee Pooja (54) - 03-03-2018"><img src="http://col3negoriginal.tv/img/category/mahee-pooja-teledrama.jpg" alt="Mahee Pooja (54) - 03-03-2018" border="0" height="90" width="118"></a></div><div class="video-title"><a href="http://www.col3negoriginalcom.com/watch.php?id=110724" title="Mahee Pooja (54) - 03-03-2018">Mahee Pooja (54) - 03-03-2018</a></div><div class="posted-time">Posted 2018-03-3<div class="posted-by">by <span class="poster">Col3neg</span></div></div><div class="video-views">Viewed 4416 times</div><div class="filter-show-link"><a href="more.php?show=774">view all items</a></div></div>
<div align="center" class="video-cell"><div class="video-thumb-wrapper"><a href="http://www.col3negoriginalcom.com/watch.php?id=110365" title="Ranhiru Ras (25) - 25-02-2018"><img src="http://col3negoriginal.tv/img/category/ranhiru-ras-teledrama.jpg" alt="Ranhiru Ras (25) - 25-02-2018" border="0" height="90" width="118"></a></div><div class="video-title"><a href="http://www.col3negoriginalcom.com/watch.php?id=110365" title="Ranhiru Ras (25) - 25-02-2018">Ranhiru Ras (25) - 25-02-2018</a></div><div class="posted-time">Posted 2018-02-25<div class="posted-by">by <span class="poster">Col3neg</span></div></div><div class="video-views">Viewed 4028 times</div><div class="filter-show-link"><a href="more.php?show=834">view all items</a></div></div>
</td></tr></table></div></div><script> var current_page = 1; var total_pages = 882; var paramString_30 = "&cat=30"; function shift_page_30 ( delta ) { var page = current_page + delta; if ( page < 1 ) { page = total_pages } if ( page > total_pages ) { page = 1 } show_page_30( page ); } function show_page_30 ( pagenum ) { new Ajax.Updater( 'page_panels_30', 'cat_panel.php?page=' + pagenum + paramString_30 + "", { evalScripts: true }); current_page = pagenum; var counter = 0; $$('#page_links_30 a').each( function(el) { ( ++ counter == current_page ) ? el.addClassName('page_selected') : el.removeClassName('page_selected') } ); } </script>
<div id="col3negoriginal-playlist-30" class="vcat-main-title"><div class="contentHd"><div>Rupavahini Teledramas</div></div></div><div class="vcat-cell"><div class="vcat-cell-header"><div class="vcat-cell-header-text"><span class="vcat-cell-title-text" id="page_links_30">Pages: <a href="./?page=1" onclick="show_page_30(1); return false" class="page_num page_selected">1</a>  <a href="./?page=2" onclick="show_page_30(2); return false" class="page_num">2</a> <a href="./?page=3" onclick="show_page_30(3); return false" class="page_num">3</a></span><span class="cat-search-link"><a href="more.php?cat=30">View all 3528 items</a></span></div></div><div class="vcat-cell-body" id="page_panels_30"><table border="0" cellpadding="0" cellspacing="0"><tr><td><div align="center" class="video-cell"><div class="video-thumb-wrapper"><a href="http://www.col3negoriginalcom.com/watch.php?id=111533" title="Rejiniyo (68) - 16-03-2018"><img src="http://col3negoriginal.tv/img/category/rejiniyo-teledrama.jpg" alt="Rejiniyo (68) - 16-03-2018" border="0" height="90" width="118"></a></div><div class="video-title"><a href="http://www.col3negoriginalcom.com/watch.php?id=111533" title="Rejiniyo (68) - 16-03-2018">Rejiniyo (68) - 16-03-2018</a></div><div class="posted-time">Posted 2018-03-16<div class="posted-by">by <span class="poster">Col3neg</span></div></div><div class="video-views">Viewed 2795 times</div><div class="filter-show-link"><a href="more.php?show=878">view all items</a></div></div>
<div align="center" class="video-cell"><div class="video-thumb-wrapper"><a href="http://www.col3negoriginalcom.com/watch.php?id=111481" title="Sanda Diya Siththam (67) - 15-03-2018"><img src="http://col3negoriginal.tv/img/category/sanda-diya-siththam-teledrama.jpg" alt="Sanda Diya Siththam (67) - 15-03-2018" border="0" height="90" width="118"></a></div><div class="video-title"><a href="http://www.col3negoriginalcom.com/watch.php?id=111481" title="Sanda Diya Siththam (67) - 15-03-2018">Sanda Diya Siththam (67) - 15-03-2018</a></div><div class="posted-time">Posted 2018-03-15<div class="posted-by">by <span class="poster">Col3neg</span></div></div><div class="video-views">Viewed 3890 times</div><div class="filter-show-link"><a href="more.php?show=868">view all items</a></div></div>
<div align="center" class="video-cell"><div class="video-thumb-wrapper"><a href="http://www.col3negoriginalcom.com/watch.php?id=111474" title="Rejiniyo (67) - 15-03-2018"><img src="http://col3negoriginal.tv/img/category/rejiniyo-teledrama.jpg" alt="Rejiniyo (67) - 15-03-2018" border="0" height="90" width="118"></a></div><div class="video-title"><a href="http://www.col3negoriginalcom.com/watch.php?id=111474" title="Rejiniyo (67) - 15-03-2018">Rejiniyo (67) - 15-03-2018</a></div><div class="posted-time">Posted 2018-03-15<div class="posted-by">by <span class="poster">Col3neg</span></div></div><div class="video-views">Viewed 4662 times</div><div class="filter-show-link"><a href="more.php?show=878">view all items</a></div></div>
<div align="center" class="video-cell"><div class="video-thumb-wrapper"><a href="http://www.col3negoriginalcom.com/watch.php?id=111430" title="Sanda Diya Siththam (66) - 14-03-2018"><img src="http://col3negoriginal.tv/img/category/sanda-diya-siththam-teledrama.jpg" alt="Sanda Diya Siththam (66) - 14-03-2018" border="0" height="90" width="118"></a></div><div class="video-title"><a href="http://www.col3negoriginalcom.com/watch.php?id=111430" title="Sanda Diya Siththam (66) - 14-03-2018">Sanda Diya Siththam (66) - 14-03-2018</a></div><div class="posted-time">Posted 2018-03-14<div class="posted-by">by <span class="poster">Col3neg</span></div></div><div class="video-views">Viewed 4128 times</div><div class="filter-show-link"><a href="more.php?show=868">view all items</a></div></div>
</td></tr></table></div></div><script> var current_page = 1; var total_pages = 1467; var paramString_666 = "&cat=666"; function shift_page_666 ( delta ) { var page = current_page + delta; if ( page < 1 ) { page = total_pages } if ( page > total_pages ) { page = 1 } show_page_666( page ); } function show_page_666 ( pagenum ) { new Ajax.Updater( 'page_panels_666', 'cat_panel.php?page=' + pagenum + paramString_666 + "", { evalScripts: true }); current_page = pagenum; var counter = 0; $$('#page_links_666 a').each( function(el) { ( ++ counter == current_page ) ? el.addClassName('page_selected') : el.removeClassName('page_selected') } ); } </script>
<div id="col3negoriginal-playlist-666" class="vcat-main-title"><div class="contentHd"><div>ITN Teledramas</div></div></div><div class="vcat-cell"><div class="vcat-cell-header"><div class="vcat-cell-header-text"><span class="vcat-cell-title-text" id="page_links_666">Pages: <a href="./?page=1" onclick="show_page_666(1); return false" class="page_num page_selected">1</a>  <a href="./?page=2" onclick="show_page_666(2); return false" class="page_num">2</a> <a href="./?page=3" onclick="show_page_666(3); return false" class="page_num">3</a></span><span class="cat-search-link"><a href="more.php?cat=666">View all 5868 items</a></span></div></div><div class="vcat-cell-body" id="page_panels_666"><table border="0" cellpadding="0" cellspacing="0"><tr><td><div align="center" class="video-cell"><div class="video-thumb-wrapper"><a href="http://www.col3negoriginalcom.com/watch.php?id=111537" title="Baddata saha Kuliyata (48) - 16-03-2018"><img src="http://col3negoriginal.tv/img/category/baddata-saha-kuliyata-teledrama.jpg" alt="Baddata saha Kuliyata (48) - 16-03-2018" border="0" height="90" width="118"></a></div><div class="video-title"><a href="http://www.col3negoriginalcom.com/watch.php?id=111537" title="Baddata saha Kuliyata (48) - 16-03-2018">Baddata saha Kuliyata (48) - 16-03-2018</a></div><div class="posted-time">Posted 2018-03-16<div class="posted-by">by <span class="poster">Col3neg</span></div></div><div class="video-views">Viewed 6340 times</div><div class="filter-show-link"><a href="more.php?show=893">view all items</a></div></div>
<div align="center" class="video-cell"><div class="video-thumb-wrapper"><a href="http://www.col3negoriginalcom.com/watch.php?id=111536" title="Pini (149) - 16-03-2018"><img src="http://col3negoriginal.tv/img/category/pini-teledrama.jpg" alt="Pini (149) - 16-03-2018" border="0" height="90" width="118"></a></div><div class="video-title"><a href="http://www.col3negoriginalcom.com/watch.php?id=111536" title="Pini (149) - 16-03-2018">Pini (149) - 16-03-2018</a></div><div class="posted-time">Posted 2018-03-16<div class="posted-by">by <span class="poster">Col3neg</span></div></div><div class="video-views">Viewed 14446 times</div><div class="filter-show-link"><a href="more.php?show=830">view all items</a></div></div>
<div align="center" class="video-cell"><div class="video-thumb-wrapper"><a href="http://www.col3negoriginalcom.com/watch.php?id=111521" title="Iskole Kale (39) - 16-03-2018"><img src="http://col3negoriginal.tv/img/category/iskole-kale-teledrama.jpg" alt="Iskole Kale (39) - 16-03-2018" border="0" height="90" width="118"></a></div><div class="video-title"><a href="http://www.col3negoriginalcom.com/watch.php?id=111521" title="Iskole Kale (39) - 16-03-2018">Iskole Kale (39) - 16-03-2018</a></div><div class="posted-time">Posted 2018-03-16<div class="posted-by">by <span class="poster">Col3neg</span></div></div><div class="video-views">Viewed 2315 times</div><div class="filter-show-link"><a href="more.php?show=907">view all items</a></div></div>
<div align="center" class="video-cell"><div class="video-thumb-wrapper"><a href="http://www.col3negoriginalcom.com/watch.php?id=111512" title="Konkala Dhoni (96) - 16-03-2018"><img src="http://col3negoriginal.tv/img/category/konkala-dhoni-teledrama.jpg" alt="Konkala Dhoni (96) - 16-03-2018" border="0" height="90" width="118"></a></div><div class="video-title"><a href="http://www.col3negoriginalcom.com/watch.php?id=111512" title="Konkala Dhoni (96) - 16-03-2018">Konkala Dhoni (96) - 16-03-2018</a></div><div class="posted-time">Posted 2018-03-16<div class="posted-by">by <span class="poster">Col3neg</span></div></div><div class="video-views">Viewed 6978 times</div><div class="filter-show-link"><a href="more.php?show=848">view all items</a></div></div>
<div align="center" class="video-cell"><div class="video-thumb-wrapper"><a href="http://www.col3negoriginalcom.com/watch.php?id=111484" title="Baddata saha Kuliyata (47) - 15-03-2018"><img src="http://col3negoriginal.tv/img/category/baddata-saha-kuliyata-teledrama.jpg" alt="Baddata saha Kuliyata (47) - 15-03-2018" border="0" height="90" width="118"></a></div><div class="video-title"><a href="http://www.col3negoriginalcom.com/watch.php?id=111484" title="Baddata saha Kuliyata (47) - 15-03-2018">Baddata saha Kuliyata (47) - 15-03-2018</a></div><div class="posted-time">Posted 2018-03-15<div class="posted-by">by <span class="poster">Col3neg</span></div></div><div class="video-views">Viewed 9674 times</div><div class="filter-show-link"><a href="more.php?show=893">view all items</a></div></div>
<div align="center" class="video-cell"><div class="video-thumb-wrapper"><a href="http://www.col3negoriginalcom.com/watch.php?id=111479" title="Pini (148) - 15-03-2018"><img src="http://col3negoriginal.tv/img/category/pini-teledrama.jpg" alt="Pini (148) - 15-03-2018" border="0" height="90" width="118"></a></div><div class="video-title"><a href="http://www.col3negoriginalcom.com/watch.php?id=111479" title="Pini (148) - 15-03-2018">Pini (148) - 15-03-2018</a></div><div class="posted-time">Posted 2018-03-15<div class="posted-by">by <span class="poster">Col3neg</span></div></div><div class="video-views">Viewed 19873 times</div><div class="filter-show-link"><a href="more.php?show=830">view all items</a></div></div>
<div align="center" class="video-cell"><div class="video-thumb-wrapper"><a href="http://www.col3negoriginalcom.com/watch.php?id=111468" title="Iskole Kale (38) - 15-03-2018"><img src="http://col3negoriginal.tv/img/category/iskole-kale-teledrama.jpg" alt="Iskole Kale (38) - 15-03-2018" border="0" height="90" width="118"></a></div><div class="video-title"><a href="http://www.col3negoriginalcom.com/watch.php?id=111468" title="Iskole Kale (38) - 15-03-2018">Iskole Kale (38) - 15-03-2018</a></div><div class="posted-time">Posted 2018-03-15<div class="posted-by">by <span class="poster">Col3neg</span></div></div><div class="video-views">Viewed 3785 times</div><div class="filter-show-link"><a href="more.php?show=907">view all items</a></div></div>
<div align="center" class="video-cell"><div class="video-thumb-wrapper"><a href="http://www.col3negoriginalcom.com/watch.php?id=111456" title="Konkala Dhoni (95) - 15-03-2018"><img src="http://col3negoriginal.tv/img/category/konkala-dhoni-teledrama.jpg" alt="Konkala Dhoni (95) - 15-03-2018" border="0" height="90" width="118"></a></div><div class="video-title"><a href="http://www.col3negoriginalcom.com/watch.php?id=111456" title="Konkala Dhoni (95) - 15-03-2018">Konkala Dhoni (95) - 15-03-2018</a></div><div class="posted-time">Posted 2018-03-15<div class="posted-by">by <span class="poster">Col3neg</span></div></div><div class="video-views">Viewed 10777 times</div><div class="filter-show-link"><a href="more.php?show=848">view all items</a></div></div>
</td></tr></table></div></div><script> var current_page = 1; var total_pages = 1186; var paramString_667 = "&cat=667"; function shift_page_667 ( delta ) { var page = current_page + delta; if ( page < 1 ) { page = total_pages } if ( page > total_pages ) { page = 1 } show_page_667( page ); } function show_page_667 ( pagenum ) { new Ajax.Updater( 'page_panels_667', 'cat_panel.php?page=' + pagenum + paramString_667 + "", { evalScripts: true }); current_page = pagenum; var counter = 0; $$('#page_links_667 a').each( function(el) { ( ++ counter == current_page ) ? el.addClassName('page_selected') : el.removeClassName('page_selected') } ); } </script>
